Title,Years,Certification,Runtime,Rating,Number of Votes,Emmys,Creators,Actors,Genres,Countries of origins,Languages,Production companies,Link
The Ren &amp; Stimpy Show,"(1991, 1996)",TV-Y7,30.0,7.5,25000,0,"John Kricfalusi, Bob Camp, Jim Gomez","John Kricfalusi, Billy West, Harris Peet, Bob Camp, Cheryl Chase, Jack Carter, Vincent Waller, Charlie Brissette, Jim Smith, Gary Owens, Edan Gross, Michael Pataki, Sharon Mack, Darrin Sargent, Alan Young, Henry Porch, Danny Cooksey, Lisa Donovan Lukas","Animation, Adventure, Comedy","United States, Canada, Australia, Taiwan, South Korea",English,"Spümcø, Nickelodeon Animation Studios, Bob Camp Productions",https://www.imdb.com/title/tt0101178/?ref_=sr_i_842
Tiger King,"(2020, 2021)",TV-MA,45.0,7.5,88000,0,,"Joe Exotic, Carole Baskin, Jeff Lowe, John Reinke, Howard Baskin, Erik Cowie, Allen Glover, Tim Stark, Eric Goode, Bhagavan Antle, Rick Kirkham, Kelci Saffery, John Finlay, Sylvia Corkill, James Garretson, Lauren Lowe, Brittany Peet, John M. Phillips","Documentary, Biography, Crime",United States,English,"A Goode Films Production, Article 19 Films, Library Films",https://www.imdb.com/title/tt11823076/?ref_=sr_i_841
Night Stalker: The Hunt for a Serial Killer,"(2021, None)",TV-MA,50.0,7.5,31000,0,,"Paul Skolnick, Gil Carrillo, Frank Salerno, Pearl Carrillo, Tony Valdez, Laurel Erickson, Linda Arthur, Zoey Tur, Colleen Nelson, Ester Petschar, Glen Creason, Don Nelson, Patty Nelson, Anastasia Hronas, Frank Falzon, Judith Kneiding Arnold, Lorraine Rodriguez, John Rodriguez","Documentary, Crime, Mystery",United States,"English, Spanish",The Intellectual Property Corporation (IPC),https://www.imdb.com/title/tt13651632/?ref_=sr_i_840
Awkward.,"(2011, 2016)",TV-14,22.0,7.5,46000,0,Lauren Iungerich,"Ashley Rickards, Beau Mirchoff, Jillian Rose Reed, Brett Davern, Molly Tarlov, Nikki Deloach, Desi Lydic, Greer Grammer, Mike Faiola, Jessica Lu, Barret Swatek, Niko Pepaj, Wesam Keesh, Monty Geer, Evan Crooks, Evan Williams, Erinn Westbrook, Nolan Gerard Funk","Comedy, Drama, Romance",United States,English,MTV/Remote Productions,https://www.imdb.com/title/tt1663676/?ref_=sr_i_839
Beavis and Butt-Head,"(1993, 2011)",TV-14,15.0,7.5,35000,0,Mike Judge,"Mike Judge, Kristofor Brown, Dale Revo, Tracy Grandstaff, Toby Huss, A.J. Glasser, Adam Welsh, Christine Walters, Lori Nasso, Kathleen Barr, Dean Julian, Thomas Middleditch, Masako Kanayama, Sam Johnson, Monica Keena, Jennifer Jane Emerson, John Andrews, Peter C. Gourdine","Animation, Comedy, Music",United States,English,"Film Roman Productions, Judgemental Films Inc., MTV Animation",https://www.imdb.com/title/tt0105950/?ref_=sr_i_838
Constantine,"(2014, 2015)",TV-14,43.0,7.5,57000,0,"Daniel Cerone, David S. Goyer","Matt Ryan, Harold Perrineau, Charles Halford, Angélica Celaya, Michael James Shaw, Mann Alfonso, Jonjo O'Neill, Jeremy Davies, Claire van der Boom, Emmett J Scanlan, David A. Gregory, Jose Pablo Cantillo, Lucy Griffiths, Patrick Carroll, Annalise Basso, Mark Margolis, Shamier Anderson, Joelle Carter","Crime, Drama, Fantasy, Horror, Thriller",United States,"English, Aramaic, Latin, Spanish, Hebrew","DC Comics, Warner Bros. Television",https://www.imdb.com/title/tt3489184/?ref_=sr_i_837
I Am Not Okay with This,"(2020, None)",TV-MA,20.0,7.5,77000,0,"Jonathan Entwistle, Christy Hall","Sophia Lillis, Wyatt Oleff, Sofia Bryant, Kathleen Rose Perkins, Richard Ellis, Luke Rozich, Zachary S. Williams, Aidan Wojtak-Hissong, Dave Theune, Sophia Tatum, Gregg Daniel, Patricia Scanlon, Jackson Frazer, Marisa Davila, Mark Colson, Morgan Kivlan, A'Nya Schofield, Shay Guthrie","Comedy, Drama, Fantasy, Sci-Fi",United States,English,21 Laps Entertainment,https://www.imdb.com/title/tt9446688/?ref_=sr_i_836
Ben 10,"(2005, 2008)",TV-Y7-FV,30.0,7.5,30000,0,"Joe Casey, Joe Kelly, Man of Action","Tara Strong, Paul Eiding, Meagan Moore, Dee Bradley Baker, Jim Ward, Steve Blum, Richard McGonagle, Fred Tatasciore, Richard Steven Horvitz, Richard Doyle, Dwight Schultz, Khary Payton, Kari Wahlgren, Jennifer Hale, Charlie Schlatter, Adam Wylie, Dave Wittenberg, Kim Mai Guest","Animation, Action, Adventure, Family, Sci-Fi",United States,English,Cartoon Network Studios,https://www.imdb.com/title/tt0760437/?ref_=sr_i_835
Hollywood,"(2020, None)",TV-MA,50.0,7.5,42000,2,"Ian Brennan, Ryan Murphy","David Corenswet, Darren Criss, Laura Harrier, Joe Mantello, Dylan McDermott, Jake Picking, Jeremy Pope, Holland Taylor, Samara Weaving, Jim Parsons, Patti LuPone, Maude Apatow, Mira Sorvino, Michelle Krusiec, Colette McDermott, Roz Witt, Rob Reiner, Brian Chenoweth","Drama, History",United States,English,Ryan Murphy Productions,https://www.imdb.com/title/tt9827854/?ref_=sr_i_834
Shooter,"(2016, 2018)",TV-14,60.0,7.5,43000,0,John Hlavin,"Ryan Phillippe, Shantel VanSanten, Cynthia Addai-Robinson, Omar Epps, Lexy Kolker, Jesse Bradford, Matt Shallenberger, Delaina Hlavin, Eddie McClintock, Gerald McRaney, Josh Stewart, David Marciano, David Andrews, John Marshall Jones, Gina Gallego, Felisha Terrell, Derek Phillips, Tom Sizemore","Action, Drama",United States,English,Closest to the Hole Productions,https://www.imdb.com/title/tt4181172/?ref_=sr_i_833
The Flintstones,"(1960, 1966)",TV-G,26.0,7.5,42000,0,"Joseph Barbera, William Hanna","Alan Reed, Mel Blanc, Jean Vander Pyl, Bea Benaderet, Don Messick, John Stephenson, Gerry Johnson, Hal Smith, Doug Young, Howard Morris, Daws Butler, Henry Corden, Allan Melvin, Harvey Korman, Janet Waldo, Jerry Mann, Frank Nelson, June Foray","Animation, Adventure, Comedy, Family",United States,English,"Hanna-Barbera Productions, Screen Gems Television",https://www.imdb.com/title/tt0053502/?ref_=sr_i_832
Being Human,"(2011, 2014)",TV-14,44.0,7.5,27000,0,"Jeremy Carver, Anna Fricke","Sam Witwer, Meaghan Rath, Sam Huntington, Kristen Hager, Gianpaolo Venuta, Connor Price, Mark Pellegrino, Deanna Russo, Kyle Schmid, Vincent Leclerc, Pat Kiely, Susanna Fournier, Alison Louder, Katharine Isabelle, Angela Galuppo, Sarah Allen, Amy Aquino, Andreas Apergis","Drama, Fantasy, Horror","Canada, United States",English,"Muse Entertainment Enterprises, Zodiak USA, Quebec Film and Television Tax Credit",https://www.imdb.com/title/tt1595680/?ref_=sr_i_831
The Mindy Project,"(2012, 2017)",TV-14,30.0,7.5,35000,0,Mindy Kaling,"Mindy Kaling, Ike Barinholtz, Ed Weeks, Chris Messina, Xosha Roquemore, Beth Grant, Adam Pally, Zoe Jarman, Fortune Feimster, Garret Dillahunt, Mark Duplass, Rhea Perlman, Jenny O'Hara, Rebecca Rittenhouse, Anders Holm, Anna Camp, Bryan Greenberg, Glenn Howerton",Comedy,United States,English,"Kaling International, 3 Arts Entertainment, Universal Television",https://www.imdb.com/title/tt2211129/?ref_=sr_i_830
Witches of East End,"(2013, 2014)",TV-14,60.0,7.5,28000,0,Maggie Friedman,"Julia Ormond, Jenna Dewan, Rachel Boston, Mädchen Amick, Daniel di Tomasso, Eric Winter, Christian Cooke, Bianca Lawson, Ignacio Serricchio, Virginia Madsen, James Marsters, Jason George, Joel Gretsch, Tom Lenk, Steven Berkoff, Enver Gjokaj, Tiya Sircar, Anthony Konechny","Drama, Fantasy, Horror, Mystery",United States,English,Fox 21,https://www.imdb.com/title/tt2288064/?ref_=sr_i_829
Roswell,"(1999, 2002)",TV-14,42.0,7.5,31000,0,Jason Katims,"Shiri Appleby, Jason Behr, Katherine Heigl, Majandra Delfino, Brendan Fehr, Nick Wechsler, William Sadler, Colin Hanks, Emilie de Ravin, Mary Ellen Trainor, Adam Rodriguez, John Doe, Garrett M. Brown, Jason Peck, Diane Farr, Devon Gummersall, Julie Benz, Desmond Askew","Drama, Mystery, Romance, Sci-Fi, Thriller",United States,English,"Jason Katims Productions, New Regency Productions, 20th Century Fox Television",https://www.imdb.com/title/tt0201391/?ref_=sr_i_828
The Dropout,"(2022, None)",TV-MA,50.0,7.5,38000,1,Elizabeth Meriwether,"Amanda Seyfried, Naveen Andrews, Michel Gill, William H. Macy, Elizabeth Marvel, Sam Waterston, Anne Archer, Kate Burton, Stephen Fry, Bill Irwin, Laurie Metcalf, Dylan Minnette, Mary Lynn Rajskub, Utkarsh Ambudkar, Ebon Moss-Bachrach, LisaGay Hamilton, Camryn Mi-young Kim, Bashir Salahuddin","Biography, Drama",United States,English,"20th Television, Elizabeth Meriwether Pictures, Searchlight Television",https://www.imdb.com/title/tt10166622/?ref_=sr_i_827
Sword Art Online,"(2012, None)",TV-14,24.0,7.5,55000,0,Reki Kawahara,"Yoshitsugu Matsuoka, Haruka Tomatsu, Bryce Papenbrook, Cherami Leigh, Ayana Taketatsu, Miyuki Sawashiro, Ai Kayano, Kanae Itô, Ayahi Takagaki, Nobunaga Shimazaki, Hiroaki Hirata, Rina Hidaka, Shin'ya Takahashi, Stephanie Sheh, Michelle Ruff, Cassandra Lee Morris, Sarah Anne Williams, Brandon James","Animation, Action, Adventure, Fantasy, Romance, Sci-Fi, Thriller","Japan, Poland, United States","Japanese, English","A-1 Pictures, ASCII Mediaworks, Aniplex",https://www.imdb.com/title/tt2250192/?ref_=sr_i_826
Dark Matter,"(2015, 2017)",TV-14,42.0,7.5,46000,0,"Joseph Mallozzi, Paul Mullie","Melissa O'Neil, Anthony Lemke, Alex Mallari Jr., Jodelle Ferland, Roger Cross, Zoie Palmer, Marc Bendavid, Melanie Liburd, Natalie Brown, Ellen Wong, David Richmond-Peck, Torri Higginson, Shaun Sipos, Andrew Moodie, Jeff Teravainen, Paula Kaye, Ennis Esmer, David Hewlett","Adventure, Drama, Mystery, Sci-Fi, Thriller",Canada,English,Blue Penguin,https://www.imdb.com/title/tt4159076/?ref_=sr_i_825
Unbreakable Kimmy Schmidt,"(2015, 2019)",TV-14,30.0,7.5,80000,0,"Robert Carlock, Tina Fey","Ellie Kemper, Jane Krakowski, Tituss Burgess, Carol Kane, Sara Chase, Sol Miranda, Lauren Adams, Mike Carlsen, Amy Sedaris, Jon Hamm, Dylan Gelula, Tanner Flood, Peter Riegert, Ki Hong Lee, Chris Northrop, Tina Fey, Gil Birmingham, Sheri Foster",Comedy,United States,English,"3 Arts Entertainment, Bevel Gears, Little Stranger",https://www.imdb.com/title/tt3339966/?ref_=sr_i_824
The Ranch,"(2016, 2020)",TV-MA,30.0,7.5,43000,3,"Jim Patterson, Don Reo","Ashton Kutcher, Sam Elliott, Grady Lee Richmond, Elisha Cuthbert, Debra Winger, Danny Masterson, Megyn Price, Kathy Baker, Laura Vallejo, Kelli Goss, Barry Corbin, Dax Shepard, Susan Blas, Wendie Malick, Justin Mooney, Ethan Suplee, Martin Mull, Jim Beaver","Comedy, Drama, Western",United States,English,Ranch Hand Productions,https://www.imdb.com/title/tt4998212/?ref_=sr_i_823
Love &amp; Death,"(2023, None)",TV-MA,54.0,7.5,41000,0,David E. Kelley,"Elizabeth Olsen, Jesse Plemons, Lily Rabe, Patrick Fugit, Krysten Ritter, Tom Pelphrey, Amelie Dallimore, Liam Pileggi, Keir Gilchrist, Olivia Grace Applegate, Kira Pozehl, Sara Burke, Harper Heath, Matthew Posey, Bonnie Gayle Sparks, Elizabeth Marvel, Jennie Page, Aaron Jay Rome","Biography, Crime, Drama, Mystery, Thriller",United States,English,"Blossom Films, David E. Kelley Productions, Lionsgate Television",https://www.imdb.com/title/tt14586350/?ref_=sr_i_822
Hawkeye,"(2021, None)",TV-14,57.0,7.5,222000,0,,"Jeremy Renner, Hailee Steinfeld, Florence Pugh, Vera Farmiga, Tony Dalton, Fra Fee, Aleks Paunovic, Piotr Adamczyk, Alaqua Cox, Linda Cardellini, Cade Woodward, Carlos Navarro, Ava Russo, Ben Sakamoto, Clayton English, Ivan Mbakop, Adetinpo Thomas, Robert Walker Branchaud","Action, Adventure, Crime, Drama, Mystery, Sci-Fi",United States,"English, American Sign Language","Disney+, Marvel Studios, Walt Disney Pictures",https://www.imdb.com/title/tt10160804/?ref_=sr_i_821
Brothers &amp; Sisters,"(2006, 2011)",TV-PG,60.0,7.5,26000,1,Jon Robin Baitz,"Dave Annable, Calista Flockhart, Rachel Griffiths, Ron Rifkin, Patricia Wettig, Sally Field, Matthew Rhys, Balthazar Getty, Kerris Dorsey, Luke Macfarlane, Maxwell Perry Cotton, Rob Lowe, Emily VanCamp, Sarah Jane Morris, Gilles Marini, Luke Grimes, Ken Olin, John Pyper-Ferguson",Drama,United States,English,"AfterPortsmouth Productions, Berlanti Television, Touchstone Television",https://www.imdb.com/title/tt0758737/?ref_=sr_i_820
All the Light We Cannot See,"(2023, None)",TV-MA,60.0,7.5,48000,0,Steven Knight,"Aria Mia Loberti, Louis Hofmann, Lars Eidinger, Hugh Laurie, Mark Ruffalo, Jakob Diehl, James Dryden, Corin Silva, Marion Bailey, Luna Wedler, Nell Sutton, Andrea Deck, Rosie Hilal, Bernd Hölscher, Elizabeth Dulau, Rhashan Stone, Sarah Crowden, Maggie Daniels","Drama, History, War",United States,English,"21 Laps Entertainment, Pioneer Stillking Films",https://www.imdb.com/title/tt15320362/?ref_=sr_i_819
Lupin,"(2021, None)",TV-MA,45.0,7.5,144000,0,George Kay,"Omar Sy, Ludivine Sagnier, Soufiane Guerrab, Etan Simon, Mamadou Haidara, Shirine Boutella, Antoine Gouy, Hervé Pierre, Clotilde Hesme, Vincent Londez, Adama Niane, Ludmilla Makowski, Noé Wodecki, Naky Sy Savane, Vincent Garanger, Martha Canga Antonio, Salif Cissé, Adrian Valli De Villebonne","Action, Crime, Drama, Mystery","France, United States",French,"Gaumont Television, Netflix",https://www.imdb.com/title/tt2531336/?ref_=sr_i_818
Mayans M.C.,"(2018, 2023)",TV-MA,60.0,7.5,25000,0,"Elgin James, Kurt Sutter","JD Pardo, Clayton Cardenas, Sarah Bolger, Michael Irby, Carla Baratta, Edward James Olmos, Frankie Loyal, Emilio Rivera, Danny Pino, Vincent Vargas, Joseph Raymond Lucero, Raoul Max Trujillo, Gino Vento, Richard Cabral, Emily Tosta, Antonio Jaramillo, Vanessa Giselle, Mia Danelle","Crime, Drama, Thriller",United States,English,"FX Productions, SutterInk, Fox 21 Television Studios",https://www.imdb.com/title/tt5715524/?ref_=sr_i_817
Shadow and Bone,"(2021, 2023)",TV-14,60.0,7.5,118000,0,Eric Heisserer,"Jessie Mei Li, Ben Barnes, Archie Renaux, Freddy Carter, Amita Suman, Kit Young, Sujaya Dasgupta, Danielle Galligan, Daisy Head, Calahan Skogman, Zoë Wanamaker, Dean Lennox Kelly, Patrick Gibson, Lewis Tan, Jack Wolfe, Anna Leong Brophy, Luke Pasqualino, Simon Sears","Action, Adventure, Drama, Fantasy, Mystery",United States,English,"21 Laps Entertainment, Netflix, Chronology Entertainment",https://www.imdb.com/title/tt2403776/?ref_=sr_i_816
Haven,"(2010, 2015)",TV-PG,60.0,7.5,42000,0,"Jim Dunn, Sam Ernst","Emily Rose, Lucas Bryant, Eric Balfour, Richard Donat, John Dunsworth, Adam Copeland, Glenn Lefchak, Jayne Eastwood, Nicholas Campbell, Kate Kelton, Laura Mennell, Emma Lahana, Bree Williamson, Molly Dunsworth, Kirsty Hinchcliffe, Colin Ferguson, Maurice Dean Wint, Christopher Shore","Crime, Drama, Fantasy, Horror, Mystery, Sci-Fi, Thriller","Canada, United States",English,"Entertainment One, Big Motion Pictures, Piller Squared/The Segan Company",https://www.imdb.com/title/tt1519931/?ref_=sr_i_815
Survivor,"(2000, None)",TV-PG,60.0,7.5,28000,7,Charlie Parsons,"Jeff Probst, Lillian Morris, Jon Dalton, Rob Mariano, Parvati Shallow, Sandra Diaz-Twine, Oscar Lusth, Rupert Boneham, Tyson Apostol, Amber Mariano, Cirie Fields, Tina Wesson, Jerri Manthey, Ethan Zohn, Colby Donaldson, Benjamin Wade, Jeremy Collins, Amanda Kimmel","Adventure, Game-Show, Reality-TV",United States,English,"Mark Burnett Productions, Castaway Television Productions, MGM Television",https://www.imdb.com/title/tt0239195/?ref_=sr_i_814
Them,"(2021, None)",TV-MA,45.0,7.5,30000,0,Little Marvin,"Deborah Ayorinde, Ashley Thomas, Shahadi Wright Joseph, Alison Pill, Melody Hurd, Ryan Kwanten, Luke James, Jeremy Bobb, Joshua J. Williams, Pam Grier, Carlito Olivero, Christopher Heyerdahl, Jeremiah Birkett, Liam McIntyre, Wayne Knight, Pat Healy, John Patrick Jordan, Sophie Guest","Drama, Horror, Thriller",United States,English,"Vertigo Entertainment, Hillman Grad, Odd Man Out (II)",https://www.imdb.com/title/tt9064858/?ref_=sr_i_813
Reign,"(2013, 2017)",TV-14,42.0,7.5,56000,0,"Laurie McCarthy, Stephanie Sengupta","Adelaide Kane, Megan Follows, Celina Sinden, Torrance Coombs, Anna Popplewell, Craig Parker, Toby Regbo, Jonathan Keltz, Rose Williams, Caitlin Stasey, Rachel Skarsten, Spencer Macpherson, Ben Geurens, Alan Van Sprang, Sean Teale, Rossif Sutherland, Dan Jeannotte, Jonathan Goad","Drama, History, Romance",United States,English,"CBS Television Studios, World 2000 Entertainment, World 2000 Entertainment",https://www.imdb.com/title/tt2710394/?ref_=sr_i_812
Under the Banner of Heaven,"(2022, None)",TV-MA,67.0,7.5,37000,0,Dustin Lance Black,"Andrew Garfield, Sam Worthington, Daisy Edgar-Jones, Denise Gough, Wyatt Russell, Billy Howle, Chloe Pirrie, Seth Numrich, Adelaide Clemens, Rory Culkin, Gil Birmingham, Megan Leitch, Taylor St. Pierre, Christopher Heyerdahl, Rohan Mead, Britt Irvin, Jerod Blake, Sandra Seacat","Crime, Drama, Mystery, Thriller",United States,English,"Aggregate Films, FX Productions, Imagine Entertainment",https://www.imdb.com/title/tt1998372/?ref_=sr_i_811
Gilmore Girls: A Year in the Life,"(2016, None)",TV-14,93.0,7.5,46000,0,Amy Sherman-Palladino,"Lauren Graham, Alexis Bledel, Scott Patterson, Kelly Bishop, Rose Abdoo, Keiko Agena, Matt Czuchry, Yanic Truesdale, Frank Gallegos, Sophia Rosales, Julio Umana, Sean Gunn, Todd Lowe, Michael Winters, Ray Wise, Aris Alvarado, Sally Struthers, Liz Torres","Comedy, Drama",United States,English,Warner Bros. Television,https://www.imdb.com/title/tt5435008/?ref_=sr_i_810
Last Man Standing,"(2011, 2021)",TV-14,30.0,7.5,38000,0,Jack Burditt,"Tim Allen, Nancy Travis, Hector Elizondo, Christoph Sanders, Amanda Fuller, Kaitlyn Dever, Molly Ephraim, Jordan Masterson, Jonathan Adams, Flynn Morrison, Molly McCook, Krista Marie Yu, Jay Leno, Alexandra Krosney, Jet Jurgensmeyer, Harlan Ray, Robert Forster, Erika Alexander",Comedy,United States,English,"21 Laps Entertainment, Marty Adelstein Productions, Double Wide Productions",https://www.imdb.com/title/tt1828327/?ref_=sr_i_809
All of Us Are Dead,"(2022, None)",TV-MA,60.0,7.5,72000,0,,"Park Ji-hu, Yoon Chan-young, Cho Yi-hyun, Park Solomon, Kim Bo-Yoon, Lim Jae-hyeok, Ahn Seung-kyoon, Son Sang-yeon, Jeon Bae-soo, Lee Kyoo-hyung, Rich Ting, Victoria Grace, Lisa Yamada, Greg Chun, Harrison Xu, Ho Eun Jin, Darren Keilan, Arvin Lee","Action, Drama, Fantasy, Horror, Sci-Fi, Thriller",South Korea,"Korean, English","Film Monster Co., Kimjonghak Production Co.",https://www.imdb.com/title/tt14169960/?ref_=sr_i_808
Batman,"(1966, 1968)",TV-G,25.0,7.5,27000,0,"Lorenzo Semple Jr., William Dozier","Adam West, Burt Ward, Alan Napier, Neil Hamilton, Stafford Repp, William Dozier, Madge Blake, Yvonne Craig, Cesar Romero, Burgess Meredith, Julie Newmar, James O'Hara, Byron Keith, Frank Gorshin, Victor Buono, David Lewis, Vincent Price, Anne Baxter","Action, Crime, Fantasy",United States,English,"20th Century Fox Television, Greenway Productions [us]",https://www.imdb.com/title/tt0059968/?ref_=sr_i_807
The A-Team,"(1983, 1987)",TV-PG,60.0,7.5,43000,0,"Stephen J. Cannell, Frank Lupo","George Peppard, Mr. T, Dwight Schultz, Dirk Benedict, Melinda Culea, Lance LeGault, Carl Franklin, Eddie Velez, Robert Vaughn, Marla Heasley, Bill Dyer, Jack Ging, Judith Ledford, Tony Ciccone, Thomas Rosales Jr., Mills Watson, Ismael 'East' Carlo, Red West","Action, Adventure, Crime",United States,English,"Stephen J. Cannell Productions, Universal Television",https://www.imdb.com/title/tt0084967/?ref_=sr_i_806
Castle Rock,"(2018, 2019)",TV-MA,60.0,7.5,53000,0,"Sam Shaw, Dustin Thomason","Bill Skarsgård, André Holland, Lizzy Caplan, Melanie Lynskey, Paul Sparks, Barkhad Abdi, Jane Levy, Yusra Warsama, Sissy Spacek, Elsie Fisher, Matthew Alan, Tim Robbins, Caleel Harris, Scott Glenn, Adam Rothenberg, Aaron Staton, Tenea Intriago, Noel Fisher","Drama, Fantasy, Horror, Mystery, Sci-Fi, Thriller",United States,English,"Bad Robot, Old Curiosity Shop, Warner Bros.",https://www.imdb.com/title/tt6548228/?ref_=sr_i_805
"Magnum, P.I.","(1980, 1988)",TV-PG,48.0,7.5,30000,2,"Donald P. Bellisario, Glen A. Larson","Tom Selleck, John Hillerman, Roger E. Mosley, Larry Manetti, Gillian Dobb, Kwan Hi Lim, Jeff MacKay, Kathleen Lloyd, Glenn Cannon, Patrick Bishop, Elisha Cook Jr., Lance LeGault, Jean Bruce Scott, Elissa Dulce, Esmond Chung, James Grant Benton, Clyde Kusatsu, Phyllis Davis","Action, Adventure, Crime, Drama, Mystery",United States,English,"Belisarius Productions, Glen A. Larson Productions, Universal Television",https://www.imdb.com/title/tt0080240/?ref_=sr_i_804
Star Trek: Picard,"(2020, 2023)",TV-MA,46.0,7.5,97000,1,"Kirsten Beyer, Michael Chabon, Akiva Goldsman","Patrick Stewart, Michelle Hurd, Jeri Ryan, Alison Pill, Santiago Cabrera, Evan Evagora, Isa Briones, Brent Spiner, Jonathan Frakes, Kay Bess, Orla Brady, Ed Speleers, Gates McFadden, Todd Stashwick, Ashlei Sharpe Chestnut, Joseph Lee, Jin Maley, Amy Earhart","Action, Adventure, Drama, Sci-Fi",United States,English,"CBS Television Studios, Roddenberry Entertainment, Secret Hideout",https://www.imdb.com/title/tt8806524/?ref_=sr_i_803
Titans,"(2018, 2023)",TV-MA,45.0,7.5,115000,0,"Greg Berlanti, Akiva Goldsman, Geoff Johns","Brenton Thwaites, Anna Diop, Ryan Potter, Teagan Croft, Joshua Orpin, Curran Walters, Conor Leslie, Minka Kelly, Jay Lycurgo, Alan Ritchson, Joseph Morgan, Vincent Kartheiser, Iain Glen, Franka Potente, Savannah Welch, Esai Morales, Damaris Lewis, James Scully","Action, Adventure, Crime, Drama, Fantasy, Sci-Fi",United States,English,"Berlanti Productions, DC Entertainment, Warner Bros. Television",https://www.imdb.com/title/tt1043813/?ref_=sr_i_802
13 Reasons Why,"(2017, 2020)",TV-MA,60.0,7.5,322000,0,Brian Yorkey,"Dylan Minnette, Katherine Langford, Christian Navarro, Alisha Boe, Brandon Flynn, Justin Prentice, Ross Butler, Devin Druid, Amy Hargreaves, Miles Heizer, Timothy Granaderos, Michael Sadler, Josh Hamilton, Caleb Pilkenton, Derek Luke, Kate Walsh, Mark Pellegrino, Steven Weber","Drama, Mystery, Thriller",United States,English,"July Moon Productions, Kicked to the Curb Productions, Anonymous Content",https://www.imdb.com/title/tt1837492/?ref_=sr_i_801
Heroes,"(2006, 2010)",TV-14,45.0,7.5,254000,1,Tim Kring,"Jack Coleman, Hayden Panettiere, Milo Ventimiglia, Masi Oka, Sendhil Ramamurthy, Greg Grunberg, James Kyson, Adrian Pasdar, Zachary Quinto, Ali Larter, Cristine Rose, Ashley Crow, Jimmy Jean-Louis, Noah Gray-Cabey, Randall Bentley, Robert Knepper, Santiago Cabrera, Leonard Roberts","Crime, Drama, Fantasy, Mystery, Sci-Fi, Thriller",United States,"English, Japanese, Spanish","Tailwind Productions, NBC Universal Television, Universal Media Studios (UMS)",https://www.imdb.com/title/tt0813715/?ref_=sr_i_800
King of the Hill,"(1997, 2010)",TV-14,30.0,7.5,60000,2,"Greg Daniels, Mike Judge","Mike Judge, Kathy Najimy, Pamela Adlon, Johnny Hardwick, Stephen Root, Brittany Murphy, Toby Huss, David Herman, Ashley Gardner, Lauren Tom, Breckin Meyer, Dennis Burkley, Jonathan Joss, Scott Klace, Tom Petty, Naoki Tatsuta, Fujiko Takimoto, Phil Hendrie","Animation, Comedy, Drama",United States,English,"Deedle-Dee Productions, Judgmental Films, 3 Arts Entertainment",https://www.imdb.com/title/tt0118375/?ref_=sr_i_799
Ahsoka,"(2023, None)",TV-14,54.0,7.5,123000,1,Dave Filoni,"Rosario Dawson, David Tennant, Natasha Liu Bordizzo, Mary Elizabeth Winstead, Ray Stevenson, Ivanna Sakhno, Diana Lee Inosanto, Eman Esfandi, Hayden Christensen, Nican Robinson, Paul Darnell, Dawn Dininger, Evan Whitten, Lars Mikkelsen, Genevieve O'Reilly, Paul Sun-Hyung Lee, Wes Chatham, Jeryl Prescott","Action, Adventure, Drama, Fantasy, Sci-Fi",United States,English,"Golem Creations, Lucasfilm",https://www.imdb.com/title/tt13622776/?ref_=sr_i_798
Agents of S.H.I.E.L.D.,"(2013, 2020)",TV-PG,45.0,7.5,228000,0,"Maurissa Tancharoen, Jed Whedon, Joss Whedon","Clark Gregg, Ming-Na Wen, Brett Dalton, Iain De Caestecker, Chloe Bennet, Elizabeth Henstridge, Henry Simmons, Natalia Cordova-Buckley, Jeff Ward, Nick Blood, Adrianne Palicki, Luke Mitchell, John Hannah, Maximilian Osinski, Joel Stoffer, Adrian Pasdar, B.J. Britt, Briana Venskus","Action, Adventure, Drama, Sci-Fi, Thriller",United States,English,"Mutant Enemy, Marvel Television, ABC Studios",https://www.imdb.com/title/tt2364582/?ref_=sr_i_797
Ginny &amp; Georgia,"(2021, None)",TV-14,0.0,7.5,86000,0,Sarah Lampert,"Brianne Howey, Antonia Gentry, Felix Mallard, Sara Waisglass, Katie Douglas, Chelsea Clark, Diesel La Torraca, Scott Porter, Raymond Ablack, Jennifer Robertson, Mason Temple, Dan Beirne, Nikki Roumel, Sabrina Grdevich, Alex Mallari Jr., Damian Romeo, Colton Gobbo, Rebecca Ablack","Comedy, Drama",United States,English,"Blue Ice Pictures, Critical Content, Dynamic Television",https://www.imdb.com/title/tt10813940/?ref_=sr_i_796
Little House on the Prairie,"(1974, 1983)",TV-PG,60.0,7.5,28000,4,Blanche Hanalis,"Melissa Gilbert, Michael Landon, Karen Grassle, Rachel Lindsay Greenbush, Sidney Greenbush, Melissa Sue Anderson, Katherine MacGregor, Richard Bull, Jonathan Gilbert, Kevin Hagen, Alison Arngrim, Matthew Labyorteaux, Dabbs Greer, Dean Butler, Ruth Foster, Brenda Turnbaugh, Wendi Turnbaugh, Victor French","Drama, Family, Romance, Western",United States,English,,https://www.imdb.com/title/tt0071007/?ref_=sr_i_795
Arrow,"(2012, 2020)",TV-14,42.0,7.5,450000,0,"Greg Berlanti, Marc Guggenheim, Andrew Kreisberg","Stephen Amell, Katie Cassidy, David Ramsey, Susanna Thompson, Emily Bett Rickards, Paul Blackthorne, Willa Holland, Colton Haynes, Rick Gonzalez, Echo Kellum, John Barrowman, Juliana Harkavy, Keri Adams, Manu Bennett, Audrey Marie Anderson, Caity Lotz, David Nykl, Colin Donnell","Action, Adventure, Crime, Drama, Mystery, Sci-Fi",United States,"English, Greek, Arabic, Russian, Chinese, Spanish, Japanese","Berlanti Productions, DC Entertainment, Warner Bros. Television",https://www.imdb.com/title/tt2193021/?ref_=sr_i_794
The Night Agent,"(2023, None)",TV-MA,45.0,7.5,117000,0,,"Gabriel Basso, Luciane Buchanan, Fola Evans-Akingbola, Sarah Desjardins, Eve Harlow, Phoenix Raei, Enrique Murciano, D.B. Woodside, Hong Chau, Brittany Snow, Teddy Sears, Navid Negahban, Michael Malarkey, Berto Colon, Arienne Mandi, Amanda Warren, Rob Heaps, Keon Alexander","Action, Drama, Thriller",United States,English,"Exhibit A, MiddKid Productions, Project X Entertainment",https://www.imdb.com/title/tt13918776/?ref_=sr_i_793
