Title,Years,Certification,Runtime,Rating,Number of Votes,Emmys,Creators,Actors,Genres,Countries of origins,Languages,Production companies,Link
Peacemaker,"(2022, None)",TV-MA,40.0,8.3,142000,0,James Gunn,"John Cena, Danielle Brooks, Freddie Stroma, Jennifer Holland, Steve Agee, Dee Bradley Baker, Chukwudi Iwuji, Robert Patrick, Annie Chang, Lochlyn Munro, Elizabeth Faith Ludlow, Rochelle Greenwood, Zak Santiago, Neil Webb, Kevin O'Grady, Bzhaun Rhoden, Nhut Le, Christopher Heyerdahl","Action, Adventure, Comedy, Crime, Fantasy, Sci-Fi",United States,English,"DC Entertainment, The Safran Company, Troll Court Entertainment",https://www.imdb.com/title/tt13146488/?ref_=sr_i_343
30 Rock,"(2006, 2013)",TV-14,22.0,8.3,134000,16,Tina Fey,"Tina Fey, Alec Baldwin, Tracy Morgan, Jack McBrayer, Jane Krakowski, Scott Adsit, Judah Friedlander, Keith Powell, Katrina Bowden, Kevin Dotcom Brown, Grizz Chapman, John Lutz, Maulik Pancholy, Lonny Ross, Sue Galloway, Chris Parnell, Christine J. Noble, Rachel Dratch",Comedy,United States,"English, Irish Gaelic","Broadway Video, Little Stranger, NBC Studios",https://www.imdb.com/title/tt0496424/?ref_=sr_i_342
Solo Leveling,"(2024, None)",TV-MA,0.0,8.3,32000,0,Chugong,"Taito Ban, Aleks Le, Min Seung-woo, Haruna Mikawa, Rina Honnizumi, Dani Chambers, Rebecca Wang, Genta Nakamura, Makoto Furukawa, Eiji Hanawa, Ryosuke Higa, Ikuto Kanemasa, SungWon Cho, Sean Hennigan, Banjô Ginga, Kakeru Hatano, Justin Briner, Daisuke Hirakawa","Animation, Action, Adventure, Fantasy","Japan, South Korea","Japanese, English","Aniplex, A-1 Pictures, A-1 Pictures",https://www.imdb.com/title/tt21209876/?ref_=sr_i_341
The Killing,"(2011, 2014)",TV-14,45.0,8.3,127000,0,Veena Sud,"Mireille Enos, Joel Kinnaman, Billy Campbell, Liam James, Michelle Forbes, Brent Sexton, Kristin Lehman, Eric Ladin, Jamie Anne Allman, Evan Bird, Seth Isaac Johnson, Tom Butler, Annie Corley, Gregg Henry, Brendan Sexton III, Amy Seimetz, Garry Chalk, Katie Findlay","Crime, Drama, Mystery, Thriller","United States, Canada",English,"KMF Films, Fuse Entertainment, Fox Television Studios",https://www.imdb.com/title/tt1637727/?ref_=sr_i_340
Ray Donovan,"(2013, 2020)",TV-MA,60.0,8.3,95000,1,Ann Biderman,"Liev Schreiber, Eddie Marsan, Dash Mihok, Pooch Hall, Kerris Dorsey, Jon Voight, Kate Moennig, Devon Bagby, Paula Malcomson, Steven Bauer, Graham Rogers, Alyssa Diaz, William Stanford Davis, Susan Sarandon, Elliott Gould, Michael McGrady, Dominique Columbus, Denise Crosby","Crime, Drama",United States,English,"David Hollander Productions, The Mark Gordon Company",https://www.imdb.com/title/tt2249007/?ref_=sr_i_339
Why Women Kill,"(2019, 2021)",TV-MA,0.0,8.3,33000,0,Marc Cherry,"Jack Davenport, Lucy Liu, Allison Tolman, Ginnifer Goodwin, Lana Parrilla, Kirby Howell-Baptiste, B.K. Cannon, Alexandra Daddario, Jordane Christie, Sam Jaeger, Matthew Daddario, Sadie Calvano, Nick Frost, Reid Scott, Virginia Williams, Veronica Falcón, Alicia Coppola, Leo Howard","Comedy, Crime, Drama",United States,English,"Imagine Entertainment, CBS Television Studios, Acme Productions",https://www.imdb.com/title/tt9054904/?ref_=sr_i_338
Taboo,"(2017, None)",TV-MA,60.0,8.3,152000,0,"Chips Hardy, Tom Hardy, Steven Knight","Tom Hardy, David Hayman, Jonathan Pryce, Oona Chaplin, Richard Dixon, Leo Bill, Edward Hogg, Ruby-May Martinwood, Jessie Buckley, Stephen Graham, Franka Potente, James Greaves, Michael Kelly, Louis Ashbourne Serkis, Jefferson Hall, Jason Watkins, Scroobius Pip, Danny Ligairi","Drama, Mystery, Thriller",United Kingdom,English,"Hardy, Son &amp; Baker, Scott Free Productions",https://www.imdb.com/title/tt3647998/?ref_=sr_i_337
Maid,"(2021, None)",TV-MA,60.0,8.3,106000,0,Molly Smith Metzler,"Margaret Qualley, Nick Robinson, Rylea Nevaeh Whittet, Andie MacDowell, Anika Noni Rose, Tracy Vilar, Billy Burke, BJ Harrison, Raymond Ablack, Xavi de Guzman, Toby Levins, Christie Burke, Angelina Pepper, Amy Reid, Anthony Scardera, Sook Hexamer, Aimee Carrero, Mozhan Navabi",Drama,United States,English,"John Wells Productions, John Wells Productions, LuckyChap Entertainment",https://www.imdb.com/title/tt11337908/?ref_=sr_i_336
Barry,"(2018, 2023)",TV-MA,30.0,8.3,128000,10,"Alec Berg, Bill Hader","Bill Hader, Stephen Root, Sarah Goldberg, Anthony Carrigan, Henry Winkler, D'Arcy Carden, Michael Irby, Rightor Doyle, Darrell Britt-Gibson, Andy Carey, Alejandro Furth, Kirby Howell-Baptiste, Sarah Burns, John Pirruccello, Jessy Hodges, Nick Gracer, Turhan Troy Caylak, Andrew Leeds","Action, Comedy, Crime, Drama",United States,English,"Alec Berg Productions, Hanarply",https://www.imdb.com/title/tt5348176/?ref_=sr_i_335
The Originals,"(2013, 2018)",TV-14,45.0,8.3,152000,0,Julie Plec,"Joseph Morgan, Daniel Gillies, Claire Holt, Phoebe Tonkin, Charles Michael Davis, Yusuf Gatewood, Danielle Campbell, Leah Pipes, Riley Voelkel, Steven Krueger, Nathan Parsons, Nathaniel Buzolic, Sebastian Roché, Christina Moses, Maisie Richardson-Sellers, Andrew Lees, Colin Woodell, Rebecca Breeds","Drama, Fantasy, Horror, Mystery",United States,English,"Bonanza Productions, My So-Called Company, Alloy Entertainment",https://www.imdb.com/title/tt2632424/?ref_=sr_i_334
Columbo,"(1971, 1978)",TV-PG,100.0,8.3,44000,13,"Richard Levinson, William Link","Peter Falk, Mike Lally, Dianne Travis, Bruce Kirby, John Finnegan, Fred Draper, Vito Scotti, Val Avery, Jack Cassidy, Robert Culp, Arlene Martel, Richard Stahl, Victor Izay, Jerome Guardino, Cliff Carnell, Harvey Gold, Jimmy Joyce, Dennis Robertson","Crime, Drama, Mystery, Thriller",United States,English,NBC Universal Television,https://www.imdb.com/title/tt1466074/?ref_=sr_i_333
Longmire,"(2012, 2017)",TV-14,60.0,8.3,41000,0,"Hunt Baldwin, John Coveny","Robert Taylor, Katee Sackhoff, Lou Diamond Phillips, Cassidy Freeman, Adam Bartley, Louanne Stephens, Bailey Chase, A Martinez, Zahn McClarnon, Derek Phillips, Graham Greene, John Bishop, Joseph Daniel Havenstar, Barry Sloane, Hank Cheyne, Louis Herthum, Tamara Duarte, Gerald McRaney","Action, Crime, Drama, Western",United States,"English, French","Two Boomerang, The Shephard/Robin Company, Warner Horizon Television",https://www.imdb.com/title/tt1836037/?ref_=sr_i_332
One Piece,"(2023, None)",TV-14,60.0,8.3,162000,0,"Matt Owens, Steven Maeda","Iñaki Godoy, Emily Rudd, Mackenyu, Vincent Regan, Morgan Davies, Aidan Scott, Armand Aucamp, Jacob Romero, Jeff Ward, Taz Skylar, McKinley Belcher III, Craig Fairbrass, Jandre le Roux, Steven John Ward, Celeste Loots, Peter Gadiot, Colton Osorio, Kathleen Stephens","Action, Adventure, Comedy, Drama, Fantasy","United Kingdom, United States, South Africa, Japan",English,"Tomorrow Studios, Film Afrika Worldwide, Kaji Productions",https://www.imdb.com/title/tt11737520/?ref_=sr_i_331
Homeland,"(2011, 2020)",TV-MA,60.0,8.3,365000,8,"Alex Gansa, Howard Gordon","Claire Danes, Mandy Patinkin, Damian Lewis, Rupert Friend, Maury Sterling, F. Murray Abraham, Morena Baccarin, Jackson Pace, Morgan Saylor, Diego Klattenhoff, Elizabeth Marvel, David Harewood, Tracy Letts, Linus Roache, David Marciano, Sarita Choudhury, Amy Hargreaves, Navid Negahban","Crime, Drama, Mystery, Thriller",United States,English,"Teakwood Lane Productions, Cherry Pie Productions, Keshet Broadcasting",https://www.imdb.com/title/tt1796960/?ref_=sr_i_330
Shetland,"(2013, None)",TV-14,60.0,8.3,27000,0,,"Alison O'Donnell, Steven Robertson, Lewis Howden, Douglas Henshall, Mark Bonnar, Anne Kidd, Erin Armstrong, Julie Graham, Conor McCarry, Angus Miller, Ashley Jensen, Neve McIntosh, Lucianne McEvoy, Fiona Bell, Julia Brown, Anneika Rose, Eubha Akilade, Steven Miller","Crime, Drama, Mystery",United Kingdom,English,"ITV Studios, Silverprint Pictures, BBC Scotland",https://www.imdb.com/title/tt2396135/?ref_=sr_i_329
Star Trek: Strange New Worlds,"(2022, None)",TV-PG,52.0,8.3,62000,0,"Akiva Goldsman, Alex Kurtzman, Jenny Lumet","Anson Mount, Ethan Peck, Christina Chong, Melissa Navia, Rebecca Romijn, Jess Bush, Celia Rose Gooding, Babs Olusanmokun, Alex Kapp, Dan Jeannotte, Bruce Horak, Rong Fu, André Dae Kim, Melanie Scrofano, Carol Kane, Adrian Holmes, Paul Wesley, Gia Sandhu","Action, Adventure, Sci-Fi",United States,English,"CBS Television Studios, Roddenberry Entertainment, Secret Hideout",https://www.imdb.com/title/tt12327578/?ref_=sr_i_328
Billions,"(2016, 2023)",TV-MA,60.0,8.3,112000,0,"Brian Koppelman, David Levien, Andrew Ross Sorkin","Paul Giamatti, Damian Lewis, Maggie Siff, David Costabile, Dola Rashad, Daniel K. Isaac, Jeffrey DeMunn, Asia Kate Dillon, Kelly AuCoin, Dan Soder, Toby Leonard Moore, Dhruv Maheshwari, Kira Visser, Louis Cancelmi, Zina Wilde, Stephen Kunken, Lilly Moran, Ben Shenkman",Drama,United States,English,"Showtime Entertainment, Best Available!, Lightnin' Production Rentals",https://www.imdb.com/title/tt4270492/?ref_=sr_i_327
The Leftovers,"(2014, 2017)",TV-MA,60.0,8.3,117000,0,"Damon Lindelof, Tom Perrotta","Justin Theroux, Amy Brenneman, Christopher Eccleston, Liv Tyler, Chris Zylka, Carrie Coon, Margaret Qualley, Ann Dowd, Kevin Carroll, Jovan Adepo, Janel Moloney, Michael Gaston, Regina King, Scott Glenn, Annie Q. Riegel, Emily Meade, Amanda Warren, Max Carver","Drama, Fantasy, Mystery, Thriller",United States,English,"Film 44, Warner Bros. Television",https://www.imdb.com/title/tt2699128/?ref_=sr_i_326
Bad Sisters,"(2022, None)",TV-MA,53.0,8.3,39000,0,"Brett Baer, Dave Finkel, Sharon Horgan","Sharon Horgan, Anne-Marie Duff, Sarah Greene, Eva Birthistle, Eve Hewson, Saise Quinn, Claes Bang, Brian Gleeson, Daryl McCormack, Jonjo O'Neill, Michael Smiley, Lloyd Hutchinson, Aidan McCann, Yasmine Akram, Peter Coonan, Nina Norén, Assaad Bouab, Jake Farmer","Comedy, Drama, Thriller","United States, Belgium, United Kingdom, Ireland",English,"ABC Signature, Apple, CAMA Asset Storage &amp; Recycling",https://www.imdb.com/title/tt15469618/?ref_=sr_i_325
1923,"(2022, 2025)",TV-MA,60.0,8.3,59000,0,Taylor Sheridan,"Harrison Ford, Helen Mirren, Brandon Sklenar, Darren Mann, Julia Schlaepfer, Jerome Flynn, Isabel May, Brian Geraghty, Aminah Nieves, Michelle Randolph, Caleb Martin, Robert Patrick, Marley Shelton, Brian Konowal, Sebastian Roché, Timothy Dalton, Jennifer Ehle, Michael Greyeyes","Drama, Western",United States,English,"101 Studios, Bosque Ranch Productions, MTV Entertainment Studios",https://www.imdb.com/title/tt18335752/?ref_=sr_i_324
Buffy the Vampire Slayer,"(1997, 2003)",TV-14,44.0,8.3,163000,2,Joss Whedon,"Sarah Michelle Gellar, Nicholas Brendon, Alyson Hannigan, Anthony Head, James Marsters, Emma Caulfield Ford, Michelle Trachtenberg, Kristine Sutherland, Charisma Carpenter, David Boreanaz, Amber Benson, Seth Green, Marc Blucas, Danny Strong, Tom Lenk, Eliza Dushku, Armin Shimerman, Juliet Landau","Action, Adventure, Drama, Fantasy, Romance",United States,English,"Mutant Enemy, Kuzui Enterprises., Sandollar Television",https://www.imdb.com/title/tt0118276/?ref_=sr_i_323
Euphoria,"(2019, None)",TV-MA,55.0,8.3,258000,9,Sam Levinson,"Zendaya, Hunter Schafer, Jacob Elordi, Maude Apatow, Alexa Demie, Sydney Sweeney, Angus Cloud, Barbie Ferreira, Nika King, Javon 'Wanna' Walton, Eric Dane, Storm Reid, Austin Abrams, Alanna Ubach, Algee Smith, Paula Marshall, John Ales, Tyler Chase",Drama,United States,English,"A24, Home Box Office (HBO), Little Lamb",https://www.imdb.com/title/tt8772296/?ref_=sr_i_322
How I Met Your Mother,"(2005, 2014)",TV-14,23.0,8.3,745000,10,"Carter Bays, Craig Thomas","Josh Radnor, Jason Segel, Cobie Smulders, Neil Patrick Harris, Alyson Hannigan, Lyndsy Fonseca, David Henrie, Cristin Milioti, Marshall Manesh, Joe Nieves, Charlene Amoia, Ashley Williams, Suzie Plakson, Jennifer Morrison, Wayne Brady, Bill Fagerbakke, Ellen D. Williams, Chris Elliott","Comedy, Drama, Romance",United States,"English, Persian, Chinese","20th Century Fox Television, Bays Thomas Productions",https://www.imdb.com/title/tt0460649/?ref_=sr_i_321
House of the Dragon,"(2022, None)",TV-MA,50.0,8.3,452000,1,"Ryan J. Condal, George R.R. Martin","Matt Smith, Emma D'Arcy, Olivia Cooke, Fabien Frankel, Steve Toussaint, Rhys Ifans, Jefferson Hall, Kurt Egyiawan, Sonoya Mizuno, Matthew Needham, Ewan Mitchell, Paul Kennedy, Eve Best, Harry Collett, Paddy Considine, Phil Daniels, Tom Glynn-Carney, Bethany Antonia","Action, Adventure, Drama, Fantasy, Romance",United States,English,"1:26 Pictures, Home Box Office (HBO)",https://www.imdb.com/title/tt11198330/?ref_=sr_i_320
Prison Break,"(2005, 2017)",TV-14,44.0,8.3,602000,0,Paul T. Scheuring,"Dominic Purcell, Wentworth Miller, Amaury Nolasco, Robert Knepper, Sarah Wayne Callies, Wade Williams, William Fichtner, Paul Adelstein, Rockmond Dunbar, Jodi Lyn O'Keefe, Leon Russom, Marshall Allman, Robin Tunney, Stacy Keach, Michael Rapaport, Peter Stormare, Phillip Edward Van Lear, Muse Watson","Action, Crime, Drama, Mystery, Thriller","United Kingdom, United States","English, Spanish, Arabic","Adelstein-Parouse Productions, Dawn Olmstead Productions, Adelstein Productions",https://www.imdb.com/title/tt0455275/?ref_=sr_i_319
Lost,"(2004, 2010)",TV-14,45.0,8.3,618000,10,"J.J. Abrams, Jeffrey Lieber, Damon Lindelof","Jorge Garcia, Josh Holloway, Yunjin Kim, Evangeline Lilly, Terry O'Quinn, Naveen Andrews, Matthew Fox, Daniel Dae Kim, Emilie de Ravin, Michael Emerson, Henry Ian Cusick, Dominic Monaghan, Harold Perrineau, Elizabeth Mitchell, Ken Leung, Nestor Carbonell, Maggie Grace, Malcolm David Kelley","Adventure, Drama, Fantasy, Mystery, Sci-Fi, Thriller",United States,"English, Portuguese, Spanish, Arabic, French, Korean, German, Latin, Russian, Japanese","Bad Robot, Touchstone Television, ABC Signature",https://www.imdb.com/title/tt0411008/?ref_=sr_i_318
The Heroes,"(2008, None)",,0.0,8.4,169000,0,,"Ali Hemmat Momivand, Shahrooz Malek Arayi, Bijan Alimohamadi, Siamak Atlassi, Hamid Reza Ashtianipoor, Tooraj Nasr","Animation, Drama, History",Iran,Persian,"Harekat-e-Kelidi Animation Studio, Saba Animation Studio",https://www.imdb.com/title/tt7657124/?ref_=sr_i_317
The Colbert Report,"(2005, 2014)",TV-14,30.0,8.4,39000,7,"Stephen Colbert, Ben Karlin, Jon Stewart","Stephen Colbert, Jay Katsir, Jon Stewart, Paul Dinello, Trevor Potter, Andrew Sullivan, Neil deGrasse Tyson, Tim Meadows, Mike Huckabee, James Martin, Emily Bazelon, Eric Frandsen, Tom Brokaw, Peter Gwinn, Ken Burns, Jim Cramer, Arianna Huffington, Henry Kissinger","Comedy, News, Talk-Show",United States,English,"Busboy Productions, Comedy Central, Hello Doggie",https://www.imdb.com/title/tt0458254/?ref_=sr_i_316
Top Gear,"(1978, 2002)",TV-PG,30.0,8.4,25000,0,,"Tiff Needell, Jeremy Clarkson, Quentin Willson, Chris Goffey, William Woollard, Tony Mason, Sue Baker, Vicki Butler-Henderson, Frank Page, Steve Berry, Jason Barlow, Michele Newman, Andy Wilman, Adrian Simpson, Kate Humble, Noel Edmonds, Tom Boswell, Angela Rippon",Documentary,United Kingdom,English,,https://www.imdb.com/title/tt0163503/?ref_=sr_i_315
Dr. Horrible's Sing-Along Blog,"(2008, None)",TV-PG,42.0,8.4,44000,1,,"Neil Patrick Harris, Nathan Fillion, Felicia Day, Simon Helberg, Nick Towne, Jed Whedon, Rob Reinis, Otto Michael Penzato, Richard Partlow, Maurissa Tancharoen, Stacy Shirk, Steve Berg, David Fury, Marti Noxon, Michael Boretz, Lance W. Lanfear, Michael G. Canaan, Jonathan Reilly","Short, Comedy, Musical, Sci-Fi",United States,English,Mutant Enemy,https://www.imdb.com/title/tt1227926/?ref_=sr_i_314
Inside Look: The People v. O.J. Simpson - American Crime Story,"(2016, None)",TV-14,5.0,8.4,27000,1,,"Sarah Paulson, Sterling K. Brown, Nina Jacobson, Brad Simpson, Cuba Gooding Jr., Scott Alexander, Larry Karaszewski, Courtney B. Vance, Leon A. Walker, David Schwimmer, Kenneth Choi, Nathan Lane, John Travolta, Anthony Hemingway, Jeffrey Toobin, Christian Clemenson, Nelson Cragg, Malcolm-Jamal Warner","Documentary, Short",United States,English,"FX Network, More Media",https://www.imdb.com/title/tt6205862/?ref_=sr_i_313
Black Books,"(2000, 2004)",TV-PG,25.0,8.4,63000,0,Dylan Moran,"Dylan Moran, Bill Bailey, Tamsin Greig, Paul Beech, Daisy Campbell, Ben Homewood, Nick Frost, Tony Way, Omid Djalili, Mark Aiken, John Arthur, Terry Bird, Tony Bluto, Jessica Hynes, Rose Keegan, Nina Conti, Mick Walter, Howard Coggins",Comedy,United Kingdom,English,Assembly Film and Television,https://www.imdb.com/title/tt0262150/?ref_=sr_i_312
Generation War,"(2013, None)",TV-MA,90.0,8.4,33000,0,,"Volker Bruch, Tom Schilling, Katharina Schüttler, Miriam Stein, Ludwig Trepte, Mark Waschke, Henriette Richter-Röhl, Götz Schubert, Hildegard Schroedter, Christiane Paul, Sylvester Groth, Alina Levshin, Lucas Gregorowicz, Maxim Mehmet, Adam Markiewicz, Johanna Gastdorf, Peter Kremer, Trystan Pütter","Action, Drama, History, War",Germany,German,"Zweites Deutsches Fernsehen (ZDF), teamWorx Television &amp; Film, Beta Film",https://www.imdb.com/title/tt1883092/?ref_=sr_i_311
The Muppet Show,"(1976, 1981)",TV-G,30.0,8.4,27000,4,"Jim Henson, Jack Burns","Jim Henson, Frank Oz, Richard Hunt, Dave Goelz, Jerry Nelson, Louise Gold, Steve Whitmire, Kathryn Mullen, Eren Ozker, John Lovelady, Peter Friedman, Karen Prell, Betsy Baytos, Graham Fletcher, Brian Meehl, Bob Payne, Fran Brill, Cynthia Adler","Comedy, Family, Musical","United Kingdom, United States",English,"Associated Television (ATV), HIT Entertainment, Henson Associates (HA)",https://www.imdb.com/title/tt0074028/?ref_=sr_i_310
The Dark Crystal: Age of Resistance,"(2019, None)",TV-PG,0.0,8.4,28000,1,"Jeffrey Addiss, Will Matthews","Neil Sterenberg, Beccy Henderson, Nathalie Emmanuel, Taron Egerton, Kevin Clash, Victor Yerrid, Warrick Brownlow-Pike, Anya Taylor-Joy, Alice Dinnean, Dave Chapman, Jason Isaacs, Olly Taylor, Louise Gold, Helena Smee, Donna Kimball, Damian Farrell, Katherine Smee, Isabella Laughland","Adventure, Family, Fantasy","United Kingdom, United States",English,"The Jim Henson Company, Netflix, Canadian Film or Video Production Tax Credit (CPTC)",https://www.imdb.com/title/tt6905542/?ref_=sr_i_309
Violet Evergarden,"(2018, None)",TV-14,24.0,8.4,32000,0,,"Yui Ishikawa, Erika Harlacher, Sanshi, Raissa Bueno, Aya Endô, Reba Buhr, Takehito Koyasu, Kyle McCarley, Takuya Inagaki, Christine Marie Cabanos, Daisuke Namikawa, Minori Chihara, Cherami Leigh, Kôki Uchiyama, Haruka Tomatsu, Ben Pronsky, Tony Azzolino, Hidenobu Kiuchi","Animation, Drama, Family, Fantasy, Romance, Sci-Fi",Japan,"Japanese, English","ABC Animation, Animation DO, Bandai Namco Arts",https://www.imdb.com/title/tt7078180/?ref_=sr_i_308
The Killing,"(2007, 2012)",TV-MA,57.0,8.4,31000,0,Søren Sveistrup,"Sofie Gråbøl, Morten Suurballe, Lars Mikkelsen, Bjarne Henriksen, Ann Eleonora Jørgensen, Marie Askehave, Anne Marie Helger, Crystal Lopez, Michael Moritzen, Søren Malling, Nicolaj Kopernikus, Bent Mejding, Jonas Leth Hansen, Kasper Leth Hansen, Eske Forsting Hansen, Lotte Andersen, Laura Drasbæk, Pelle Koppel","Crime, Drama, Mystery, Thriller","Denmark, Norway, Sweden, Germany","Danish, Norwegian, Swedish","Danmarks Radio (DR), Norsk Rikskringkasting (NRK), Sveriges Television (SVT)",https://www.imdb.com/title/tt0826760/?ref_=sr_i_307
John Adams,"(2008, None)",TV-14,71.0,8.4,38000,13,,"Paul Giamatti, Laura Linney, John Dossett, Stephen Dillane, Sarah Polley, Samuel Barnett, David Morse, Andrew Scott, Danny Huston, Ebon Moss-Bachrach, Steven Hinkle, Madeline Taylor, Mamie Gummer, Kevin Trainor, Tom Wilkinson, Michael Hall D'Addario, Rufus Sewell, Justin Theroux","Biography, Drama, History",United States,English,"HBO Films, High Noon Productions, Playtone",https://www.imdb.com/title/tt0472027/?ref_=sr_i_306
Generation Kill,"(2008, None)",TV-MA,10.0,8.4,61000,3,,"Alexander Skarsgård, James Ransone, Lee Tergesen, Jon Huertas, Stark Sands, Billy Lush, Jonah Lotan, Wilson Bethel, Pawel Szajda, Marc Menchaca, Rey Valentin, Kellan Lutz, Mike Figueroa, Rudy Reyes, Rich McDonald, Eric Ladin, Chance Kelly, Eric Nenninger","Drama, War","United States, United Kingdom",English,"Boom, Blown Deadline Productions, Company Pictures",https://www.imdb.com/title/tt0995832/?ref_=sr_i_305
Erased,"(2016, None)",TV-14,22.0,8.4,62000,0,,"Shinnosuke Mitsushima, Tao Tsuchiya, Minami Takayama, Ben Diskin, Michelle Ruff, Stephanie Sheh, Sara Cravens, David W. Collins, Mitsuru Miyamoto, Yukitoshi Kikuchi, Akari Kitô, Aoi Yûki, Christine Marie Cabanos, Ayaka Nanase, Erica Mendez, Ryan Bartley, You Taichi, Bobby Thong","Animation, Crime, Drama, Fantasy, Mystery, Sci-Fi, Thriller",Japan,"Japanese, English","A-1 Pictures, Aniplex, Aniplex of America",https://www.imdb.com/title/tt5249462/?ref_=sr_i_304
Pushing Daisies,"(2007, 2009)",TV-PG,44.0,8.4,60000,7,Bryan Fuller,"Lee Pace, Anna Friel, Chi McBride, Jim Dale, Ellen Greene, Swoosie Kurtz, Kristin Chenoweth, Field Cate, Sy Richardson, Samantha Hanratty, Stephen Root, Leyna Nguyen, Diana Scarwid, Tina Gloss, Nicholas Khayyat, Jon Eric Price, David Arquette, Christine Adams","Comedy, Drama, Fantasy, Musical, Mystery, Romance",United States,English,"Jinks/Cohen Company, Living Dead Guy Productions, Warner Bros. Television",https://www.imdb.com/title/tt0925266/?ref_=sr_i_303
Mirzapur,"(2018, None)",TV-MA,60.0,8.4,88000,0,"Puneet Krishna, Karan Anshuman, Apurva Dhar Badgaiyan","Ali Fazal, Rasika Dugal, Shweta Tripathi, Pankaj Tripathi, Harshita Gaur, Rajesh Tailang, Anjumm Shharma, Sheeba Chaddha, Shahnawaz Pradhan, Shaji Chaudhary, Prashansa Sharma, Divyendu Sharma, Kulbhushan Kharbanda, Rohit Tiwari, Vijay Varma, Isha Talwar, Shernavaz Jijina, Priyanshu Painyuli","Action, Crime, Drama, Thriller",India,Hindi,"Excel Entertainment, Veena Enterprise",https://www.imdb.com/title/tt6473300/?ref_=sr_i_302
Carnivàle,"(2003, 2005)",TV-MA,60.0,8.4,47000,5,Daniel Knauf,"Michael J. Anderson, Adrienne Barbeau, Clancy Brown, Debra Christofferson, Tim DeKay, Clea DuVall, Cynthia Ettinger, Carla Gallo, Toby Huss, Amy Madigan, Nick Stahl, Brian Turk, Diane Salinger, Patrick Bauchau, Ralph Waite, John Savage, Scott MacDonald, Robert Knepper","Drama, Fantasy, Mystery, Thriller",United States,"English, Russian, French, German","3 Arts Entertainment, Home Box Office (HBO)",https://www.imdb.com/title/tt0319969/?ref_=sr_i_301
Halt and Catch Fire,"(2014, 2017)",TV-14,60.0,8.4,36000,0,"Christopher Cantwell, Christopher C. Rogers","Lee Pace, Scoot McNairy, Mackenzie Davis, Kerry Bishé, Toby Huss, August Emerson, Alana Cavanaugh, Morgan Hinkleman, Annabeth Gish, Nick Pupo, Cooper Andrews, Gabriel Manak, Mark O'Brien, Joshua Hoover, J. Elijah Cho, Aleksa Palladino, Kathryn Newton, Susanna Skaggs",Drama,United States,English,"AMC Studios, Gran Via Productions",https://www.imdb.com/title/tt2543312/?ref_=sr_i_300
Spider-Man: The Animated Series,"(1994, 1998)",TV-Y7,23.0,8.4,37000,0,"Stan Lee, Steve Ditko","Christopher Daniel Barnes, Sara Ballantine, Edward Asner, Roscoe Lee Browne, Rodney Saulsberry, Jennifer Hale, Linda Gary, Gary Imhoff, Joseph Campanella, Maxwell Caulfield, Majel Barrett, Nick Jameson, Patrick Labyorteaux, Liz Georges, Neil Ross, Jim Cummings, Dawnn Lewis, David Warner","Animation, Action, Adventure, Family, Sci-Fi",United States,English,"New World Entertainment Films, Genesis Entertainment, Marvel Entertainment Group",https://www.imdb.com/title/tt0112175/?ref_=sr_i_299
X-Men,"(1992, 1997)",TV-Y7,23.0,8.4,51000,0,"Mark Edward Edens, Sidney Iwanter, Eric Lewald","Cedric Smith, Cal Dodd, Lenore Zann, George Buza, Norm Spencer, Alyson Court, Catherine Disher, Chris Potter, Alison Sealy-Smith, David Hemblen, Lawrence Bayne, Dan Hennessey, Ron Rubin, Don Francks, Marc Strange, Philip Akin, John Colicos, Stuart Stone","Animation, Action, Adventure, Family, Sci-Fi","United States, Canada",English,"Akom Production Company, Genesis Entertainment, Graz Entertainment",https://www.imdb.com/title/tt0103584/?ref_=sr_i_298
Life on Mars,"(2006, 2007)",TV-14,52.0,8.4,33000,0,"Matthew Graham, Tony Jordan, Ashley Pharoah","John Simm, Philip Glenister, Liz White, Dean Andrews, Marshall Lancaster, Noreen Kershaw, Tony Marshall, Rafaella Hutchinson, Joanne Froggatt, Archie Panjabi, Kevin McNally, Alexander O'Loughlin, Ralph Brown, Lee Ross, Harriet Rogers, Rae Kelly Hill, Georgia Taylor, Timothy Platt","Crime, Drama, Mystery, Sci-Fi",United Kingdom,English,"Kudos Film and Television, British Broadcasting Corporation (BBC), Red Planet Pictures",https://www.imdb.com/title/tt0478942/?ref_=sr_i_297
'Allo 'Allo!,"(1982, 1992)",,0.0,8.4,28000,0,"David Croft, Jeremy Lloyd","Gorden Kaye, Carmen Silvera, Vicki Michelle, Richard Marner, Kim Hartman, Guy Siner, Kirsten Cooke, Richard Gibson, Rose Hill, Arthur Bostrom, John D. Collins, Nicholas Frankau, John Louis Mansi, Sue Hodge, Kenneth Connor, Hilary Minster, Jack Haig, Gavin Richards","Comedy, History, War",United Kingdom,English,British Broadcasting Corporation (BBC),https://www.imdb.com/title/tt0086659/?ref_=sr_i_296
Utopia,"(2013, 2014)",TV-MA,50.0,8.4,52000,0,Dennis Kelly,"Adeel Akhtar, Paul Higgins, Neil Maskell, Fiona O'Shaughnessy, Alistair Petrie, Alexandra Roach, Nathan Stewart-Jarrett, Oliver Woollford, Ruth Gemmell, Geraldine James, Emilia Jones, Paul Ready, James Fox, Anna Madeley, Stephen Rea, Sylvestra Le Touzel, Ian McDiarmid, Simon McBurney","Drama, Mystery, Sci-Fi, Thriller",United Kingdom,English,Kudos Film and Television,https://www.imdb.com/title/tt2384811/?ref_=sr_i_295
Vincenzo,"(2021, None)",Not Rated,80.0,8.4,31000,0,,"Song Joong-ki, Jeon Yeo-been, Taecyeon, Kwak Dong-yeon, Wyatt Bowen, Jo Han-chul, Kim Yoon-hye, Im Chul-soo, Holly Gauthier-Frankel, Yang Kyung-won, Kim Yeo-jin, Yoon Byung-hee, Seo Ye-hwa, Choi Deok-moon, Kim Hyung-mook, Kim Seol-jin, Lee Hang-na, Julian Stamboulieh","Action, Comedy, Crime, Drama",South Korea,Korean,"Logos Film, Studio Dragon, tvN Production",https://www.imdb.com/title/tt13433812/?ref_=sr_i_294
