Title,Years,Certification,Runtime,Rating,Number of Votes,Emmys,Creators,Actors,Genres,Countries of origins,Languages,Production companies,Link
Dead to Me,"(2019, 2022)",TV-MA,30.0,7.9,103000,0,Liz Feldman,"Christina Applegate, Linda Cardellini, Sam McCarthy, Luke Roessler, James Marsden, Max Jenkins, Diana Maria Riva, Brandon Scott, Keong Sim, Valerie Mahaffey, Natalie Morales, Suzy Nakamura, Eien Kobayashi, Telma Hopkins, Haley Sims, Frances Conroy, Dylan Kate, Adora Soleil Bricher","Comedy, Crime, Drama",United States,English,"CBS Television Studios, Gloria Sanchez Productions, Visualized",https://www.imdb.com/title/tt8064302/?ref_=sr_i_595
Modern Love,"(2019, 2021)",TV-MA,35.0,7.9,38000,0,,"Anne Hathaway, Tina Fey, Andy Garcia, Dev Patel, Cristin Milioti, Olivia Cooke, Sofia Boutella, Julia Garner, Catherine Keener, Andrew Scott, Shea Whigham, John Gallagher Jr., John Slattery, Gary Carr, Laurentiu Possa, Caitlin McGee, Brandon Kyle Goodman, Quincy Tyler Bernstine","Comedy, Drama, Romance",United States,English,"Amazon Studios, Storied Media Group",https://www.imdb.com/title/tt8543390/?ref_=sr_i_594
Weeds,"(2005, 2012)",TV-MA,28.0,7.9,119000,2,Jenji Kohan,"Mary-Louise Parker, Hunter Parrish, Alexander Gould, Kevin Nealon, Justin Kirk, Elizabeth Perkins, Andy Milder, Allie Grant, Tonye Patano, Romany Malco, Maulik Pancholy, Demián Bichir, Guillermo Diaz, Enrique Castillo, Indigo, Renee Victor, Jack Stehlin, Hemky Madera","Comedy, Crime, Drama",United States,"English, Spanish","Lions Gate Television, Tilted Productions, Weeds Productions",https://www.imdb.com/title/tt0439100/?ref_=sr_i_593
The Fresh Prince of Bel-Air,"(1990, 1996)",TV-PG,22.0,7.9,147000,0,"Andy Borowitz, Susan Borowitz","Will Smith, James Avery, Alfonso Ribeiro, Tatyana Ali, Karyn Parsons, Joseph Marcell, Daphne Reid, Janet Hubert, Ross Bagley, DJ Jazzy Jeff, Nia Long, Vernee Watson, Tyra Banks, Beverly Jackson, Jenifer Lewis, John Petlock, Virginia Capers, Jim Meskimen",Comedy,United States,English,"NBC Productions, Quincy Jones Entertainment, Quincy Jones-David Salzman Entertainment",https://www.imdb.com/title/tt0098800/?ref_=sr_i_592
Leverage,"(2008, 2012)",TV-PG,42.0,7.9,55000,0,"Chris Downey, John Rogers","Timothy Hutton, Gina Bellman, Christian Kane, Beth Riesgraf, Aldis Hodge, Mark Sheppard, Jeri Ryan, Gerald Downey, Robert Blanche, Elisabetta Canalis, Leon Rippy, Kari Matchett, Matt Barnett, Wil Wheaton, Rick Overton, Val Landrum, Lisa Schurga, Danny Bruno","Crime, Mystery, Thriller",United States,English,Electric Entertainment,https://www.imdb.com/title/tt1103987/?ref_=sr_i_591
Masters of Sex,"(2013, 2016)",TV-MA,60.0,7.9,39000,1,Michelle Ashford,"Michael Sheen, Lizzy Caplan, Caitlin FitzGerald, Teddy Sears, Annaleigh Ashford, Kevin Christy, Beau Bridges, Heléne Yorke, Nicholas D'Agosto, Julianne Nicholson, Kayla Madison, Jaeden Martell, Josh Charles, Betty Gilpin, Benjamin Koldyke, Isabelle Fuhrman, Cole Sand, Allison Janney","Drama, Romance",United States,English,"Round Two Productions, Sony Pictures Television, Timberman-Beverly Productions",https://www.imdb.com/title/tt2137109/?ref_=sr_i_590
Solar Opposites,"(2020, None)",TV-MA,22.0,7.9,32000,0,"Mike McMahan, Justin Roiland","Thomas Middleditch, Sean Giambrone, Mary Mack, Sagan McMahan, Dan Stevens, Justin Roiland, Tiffany Haddish, Kari Wahlgren, Rob Schrab, Christina Hendricks, Eric Bauza, Nolan North, Andy Daly, Sterling K. Brown, Tom Kenny, Sutton Foster, Fred Tatasciore, Carlos Alazraqui","Animation, Adventure, Comedy, Sci-Fi","United States, Canada",English,"20th Television Animation, 20th Television, 20th Century Fox Television",https://www.imdb.com/title/tt8910922/?ref_=sr_i_589
Jane the Virgin,"(2014, 2019)",TV-PG,60.0,7.9,61000,0,Jennie Snyder Urman,"Gina Rodriguez, Andrea Navedo, Yael Grobglas, Justin Baldoni, Ivonne Coll, Jaime Camil, Anthony Mendez, Brett Dier, Yara Martinez, Priscilla Barnes, Elias Janssen, Bridget Regan, Jenna Ortega, Shelly Bhalla, Ella Allan, Alfonso DiLuca, Mia Allan, Diane Guerrero",Comedy,United States,English,"Poppy Productions, RCTV, Electus",https://www.imdb.com/title/tt3566726/?ref_=sr_i_588
Humans,"(2015, 2018)",TV-14,42.0,7.9,43000,0,,"Katherine Parkinson, Gemma Chan, Lucy Carless, Tom Goodman-Hill, Colin Morgan, Theo Stevenson, Ivanno Jeremiah, Pixie Davies, Emily Berrington, Ruth Bradley, Neil Maskell, Will Tudor, Thusitha Jayasundera, Billy Jenkins, Bella Dayne, Sope Dirisu, Danny Webb, Sonya Cassidy","Drama, Sci-Fi","United Kingdom, United States, Sweden",English,,https://www.imdb.com/title/tt4122068/?ref_=sr_i_587
Eureka,"(2006, 2012)",TV-14,60.0,7.9,59000,0,"Andrew Cosby, Jaime Paglia","Colin Ferguson, Salli Richardson-Whitfield, Erica Cerra, Neil Grayston, Joe Morton, Chris Gauthier, Jordan Danger, Niall Matter, Ed Quinn, Debrah Farentino, Tembi Locke, Christopher Jacot, Kavan Smith, Felicia Day, Matt Frewer, Trevor Jackson, Jaime Ray Newman, Vanya Asher","Adventure, Comedy, Drama, Romance, Sci-Fi",United States,English,"NBC Universal Television, Universal Cable Productions",https://www.imdb.com/title/tt0796264/?ref_=sr_i_586
Merlin,"(2008, 2012)",TV-PG,45.0,7.9,89000,0,"Johnny Capps, Julian Jones, Jake Michie","John Hurt, Colin Morgan, Bradley James, Richard Wilson, Angel Coulby, Katie McGrath, Anthony Head, Rupert Young, Eoin Macken, Tom Hopper, Tomiwa Edun, Nathaniel Parker, Michael Cronin, Emilia Fox, Alexander Vlahos, Santiago Cabrera, Michelle Ryan, Caroline Faber","Adventure, Drama, Fantasy",United Kingdom,"Old English, English","Shine, BBC Wales",https://www.imdb.com/title/tt1199099/?ref_=sr_i_585
Altered Carbon,"(2018, 2020)",TV-MA,60.0,7.9,193000,0,Laeta Kalogridis,"Chris Conner, Renée Elise Goldsberry, Dichen Lachman, Will Yun Lee, Martha Higareda, Ato Essandoh, Joel Kinnaman, James Purefoy, Kristin Lehman, Trieu Tran, Hayley Law, Anthony Mackie, Lela Loren, Simone Missick, Dina Shihabi, Torben Liebrecht, Hiro Kanagawa, Waleed Zuaiter","Action, Adventure, Drama, Sci-Fi",United States,"English, Spanish, Arabic, German","Mythology Entertainment, Skydance Television",https://www.imdb.com/title/tt2261227/?ref_=sr_i_584
The Affair,"(2014, 2019)",TV-MA,60.0,7.9,50000,0,"Hagai Levi, Sarah Treem","Dominic West, Ruth Wilson, Maura Tierney, Julia Goldani Telles, Jadon Sand, Joshua Jackson, Jake Siciliano, Catalina Sandino Moreno, Omar Metwally, Leya Catlett, Kathleen Chalfant, Abigail Dylan Harrison, Josh Stamberg, Victor Williams, Colin Donnell, Darren Goldstein, Kaija Matiss, Sanaa Lathan",Drama,United States,"Mandarin, Hindi, Latin, English, Spanish, French",,https://www.imdb.com/title/tt2699110/?ref_=sr_i_583
Ted,"(2024, None)",TV-MA,0.0,7.9,32000,0,Seth MacFarlane,"Seth MacFarlane, Max Burkholder, Alanna Ubach, Scott Grimes, Giorgia Whigham, Ara Hollyday, Liz Richman, Marissa Shankar, Penny Johnson Jerald, Charly Jordan, Ian McKellen, Chelsea Davison, Charlotte Fountain-Jardim, Erin Moore, Jack Seavor McDonald, Julius Sharpe, Francesca Xuereb, Dustin Wayne",Comedy,United States,English,"Fuzzy Door Productions, MRC Television, Media Rights Capital (MRC)",https://www.imdb.com/title/tt14824792/?ref_=sr_i_582
C.B. Strike,"(2017, None)",TV-MA,60.0,7.9,26000,0,,"Tom Burke, Holliday Grainger, Kerr Logan, Jack Greenlees, Christina Cole, Natasha O'Keeffe, Killian Scott, Sarah Sweeney, Samuel Oatley, Ian Redford, Ruth Sheen, Ben Crompton, Caitlin Innes Edwards, Ann Akinjirin, Suzanne Burden, Sophie Ward, Nick Blood, Adam Long","Crime, Drama, Mystery, Thriller",United Kingdom,English,"BBC One, British Broadcasting Corporation (BBC), Bronte Film and TV",https://www.imdb.com/title/tt4276618/?ref_=sr_i_581
The Terminal List,"(2022, None)",R,55.0,7.9,111000,0,,"Chris Pratt, Constance Wu, Taylor Kitsch, Riley Keough, Arlo Mertz, Jeanne Tripplehorn, Jared Shaw, JD Pardo, LaMonica Garrett, Christina Vidal, Nick Chinlund, Tyner Rushing, Drew Starkey, Alexis Louder, Jai Courtney, Matthew Rauch, Paul McCrane, Stephen Bishop","Action, Drama, Thriller",United States,English,"Amazon Studios, Civic Center Media, Hill District Media",https://www.imdb.com/title/tt11743610/?ref_=sr_i_580
Angel,"(1999, 2004)",TV-14,44.0,7.9,77000,0,"David Greenwalt, Joss Whedon","David Boreanaz, Charisma Carpenter, Alexis Denisof, J. August Richards, Andy Hallett, Amy Acker, Stephanie Romanov, Vincent Kartheiser, James Marsters, Christian Kane, Julie Benz, Mercedes McNab, Elisabeth Röhm, Daniel Dae Kim, Glenn Quinn, Keith Szarabajka, Sarah Thompson, Mark Lutz","Action, Adventure, Drama, Fantasy, Thriller",United States,English,"Mutant Enemy, Greenwolf, Kuzui Enterprises.",https://www.imdb.com/title/tt0162065/?ref_=sr_i_579
The Man in the High Castle,"(2015, 2019)",TV-MA,60.0,7.9,114000,2,Frank Spotnitz,"Alexa Davalos, Luke Kleintank, Rufus Sewell, Rupert Evans, Joel de la Fuente, Chelah Horsdal, Brennan Brown, DJ Qualls, Cary-Hiroyuki Tagawa, Gracyn Shinyei, Genea Charpentier, Arnold Chun, Quinn Lord, Jason O'Mara, Bella Heathcote, Rick Worthy, Lee Shorten, Kenneth Tigar","Drama, Sci-Fi, Thriller","United States, United Kingdom, Canada","English, Hebrew, German, Japanese","Amazon Studios, Big Light Productions, Electric Shepherd Productions",https://www.imdb.com/title/tt1740299/?ref_=sr_i_578
The Sinner,"(2017, 2021)",TV-MA,45.0,7.9,143000,0,Derek Simonds,"Bill Pullman, Jessica Hecht, Dohn Norwood, Adam LeFevre, Jessica Biel, Christopher Abbott, Carrie Coon, Frances Fisher, Natalie Paul, Alice Kremelberg, Eddie Martinez, Abby Miller, Hannah Gross, Neal Huff, Elisha Henig, Matt Bomer, Tracy Letts, Michael Mosley","Crime, Drama, Mystery, Thriller",United States,English,"Iron Ocean Films, Universal Cable Productions",https://www.imdb.com/title/tt6048596/?ref_=sr_i_577
Preacher,"(2016, 2019)",TV-MA,60.0,7.9,83000,0,"Sam Catlin, Evan Goldberg, Seth Rogen","Dominic Cooper, Joe Gilgun, Ruth Negga, Ian Colletti, Graham McTavish, Pip Torrens, Noah Taylor, Julie Ann Emery, Malcolm Barrett, Mark Harelik, Tyson Ritter, Tom Brooke, W. Earl Brown, Lucy Griffiths, Derek Wilson, Anatol Yusef, Ronald Guttman, Colin Cunningham","Action, Adventure, Comedy, Drama, Fantasy, Horror, Mystery, Western",United States,English,"Short Drive Entertainment, Point Grey Pictures, Original Film",https://www.imdb.com/title/tt5016504/?ref_=sr_i_576
Superstore,"(2015, 2021)",TV-14,22.0,7.9,73000,0,Justin Spitzer,"Ben Feldman, Lauren Ash, Colton Dunn, Nico Santos, Mark McKinney, Nichole Sakura, Danny Gura, Jon Miyahara, America Ferrera, Kaliko Kauahi, Mariana Tosca, Selisha Shertick, Kelly Schumann, Jon Barinholtz, Irene White, Amir M. Korangy, Linda Porter, Michael Bunin",Comedy,United States,English,"Spitzer Holding Company, The District, Universal Television",https://www.imdb.com/title/tt4477976/?ref_=sr_i_575
Grimm,"(2011, 2017)",TV-14,45.0,7.9,133000,0,"Stephen Carpenter, David Greenwalt, Jim Kouf","David Giuntoli, Russell Hornsby, Silas Weir Mitchell, Sasha Roiz, Reggie Lee, Elizabeth Tulloch, Bree Turner, Claire Coffee, Robert Blanche, Damien Puckler, Jacqueline Toboni, Danny Bruno, Christian Lagadec, Alexis Denisof, Hannah R. Loyd, Anne Leighton, Philip Anthony-Rodriguez, Sharon Sachs","Crime, Drama, Fantasy, Mystery",United States,English,"GK Productions, Hazy Mills Productions, Universal Television",https://www.imdb.com/title/tt1830617/?ref_=sr_i_574
Star Trek: Voyager,"(1995, 2001)",TV-PG,44.0,7.9,79000,7,"Rick Berman, Michael Piller, Jeri Taylor","Kate Mulgrew, Robert Beltran, Roxann Dawson, Robert Duncan McNeill, Ethan Phillips, Robert Picardo, Tim Russ, Garrett Wang, Tarik Ergin, Majel Barrett, Jeri Ryan, Jennifer Lien, Richard Sarstedt, Susan Henley, Scarlett Pomers, Joey Sakata, Martha Hackett, Manu Intiraymi","Action, Adventure, Drama, Sci-Fi, Thriller",United States,English,"Paramount Television, United Paramount Network (UPN)",https://www.imdb.com/title/tt0112178/?ref_=sr_i_573
The Terror,"(2018, 2025)",TV-14,60.0,7.9,55000,0,"David Kajganich, Max Borenstein, Alexander Woo","Jared Harris, Derek Mio, Tobias Menzies, Kiki Sukezane, Paul Ready, Cristina Rodlo, Adam Nagaitis, Shingo Usami, Ian Hart, Naoko Mori, Nive Nielsen, Miki Ishikawa, Ciarán Hinds, George Takei, Christos Lawton, Matthew McNulty, David Walmsley, Sebastian Armesto","Adventure, Drama, Horror, Thriller",United States,English,"American Movie Classics (AMC), Scott Free Productions, Entertainment 360",https://www.imdb.com/title/tt2708480/?ref_=sr_i_572
Elementary,"(2012, 2019)",TV-14,60.0,7.9,121000,0,Robert Doherty,"Jonny Lee Miller, Lucy Liu, Aidan Quinn, Jon Michael Hill, Jordan Gelber, John Noble, Ophelia Lovibond, Nelsan Ellis, Ato Essandoh, Tim Guinee, Robert Capron, Desmond Harrington, James Frain, Rhys Ifans, Natalie Dormer, Samantha Quan, Liza J. Bennett, Chasten Harmon","Crime, Drama, Mystery",United States,"English, Chinese, Russian, Pashtu, French, Czech, German, Filipino, Italian, Japanese, Dutch, Spanish","Hill of Beans Productions, Timberman-Beverly Productions, CBS Television Studios",https://www.imdb.com/title/tt2191671/?ref_=sr_i_571
The Fall of the House of Usher,"(2023, None)",TV-MA,60.0,7.9,120000,0,Mike Flanagan,"Carla Gugino, Bruce Greenwood, Mary McDonnell, Henry Thomas, Kate Siegel, Rahul Kohli, Samantha Sloyan, T'Nia Miller, Zach Gilford, Willa Fitzgerald, Michael Trucco, Katie Parker, Sauriyan Sapkota, Matt Biedel, Crystal Balint, Ruth Codd, Kyliegh Curran, Carl Lumbly","Drama, Horror, Mystery",United States,English,Intrepid Pictures,https://www.imdb.com/title/tt15567174/?ref_=sr_i_570
WandaVision,"(2021, None)",TV-PG,39.0,7.9,384000,3,Jac Schaeffer,"Elizabeth Olsen, Paul Bettany, Kathryn Hahn, Teyonah Parris, Josh Stamberg, David A Payton, David Lengel, Amos Glick, Selena Anduze, Randall Park, Kat Dennings, Julian Hilliard, Debra Jo Rupp, Jett Klyne, Asif Ali, Ithamar Enriquez, Victoria Blade, Evan Peters","Action, Comedy, Drama, Fantasy, Mystery, Romance, Sci-Fi",United States,English,Marvel Studios,https://www.imdb.com/title/tt9140560/?ref_=sr_i_569
The Blacklist,"(2013, 2023)",TV-14,43.0,7.9,284000,1,Jon Bokenkamp,"James Spader, Megan Boone, Diego Klattenhoff, Ryan Eggold, Harry Lennix, Hisham Tawfiq, Amir Arison, Mozhan Navabi, Laura Sohn, Susan Blommaert, Deirdre Lovejoy, Jonathan Holtzman, Teddy Coluca, Baz, Diany Rodriguez, Anya Banerjee, Genson Blimline, Parminder Nagra","Crime, Drama, Mystery, Thriller",United States,English,"Davis Entertainment, Universal Television, Sony Pictures Television",https://www.imdb.com/title/tt2741602/?ref_=sr_i_568
ER,"(1994, 2009)",TV-14,44.0,7.9,69000,23,Michael Crichton,"Anthony Edwards, George Clooney, Julianna Margulies, Eriq La Salle, Noah Wyle, Laura Innes, Laura Cerón, Deezer D, Maura Tierney, Goran Visnjic, Yvette Freeman, Emily Wagner, Alex Kingston, Lyn Alicia Henderson, Sherry Stringfield, Abraham Benrubi, Mekhi Phifer, Parminder Nagra","Drama, Romance",United States,English,"Constant c Productions, John Wells Productions, Amblin Entertainment",https://www.imdb.com/title/tt0108757/?ref_=sr_i_567
Midsomer Murders,"(1997, None)",TV-14,90.0,7.9,41000,0,Caroline Graham,"John Nettles, Jane Wymark, Barry Jackson, Neil Dudgeon, Fiona Dolman, Jason Hughes, Laura Howard, Nick Hendrix, Daniel Casey, Sykes, Annette Badland, Kirsty Dillon, Tamzin Malleson, Gwilym Lee, John Hopkins, Isabel Shaw, Manjinder Virk, Neil Conrich","Crime, Drama, Mystery",United Kingdom,English,"Bentley Productions, ITV - Independent Television",https://www.imdb.com/title/tt0118401/?ref_=sr_i_566
Escape at Dannemora,"(2018, None)",TV-MA,63.0,7.9,29000,0,"Brett Johnson, Michael Tolkin","Benicio Del Toro, Patricia Arquette, Paul Dano, Bonnie Hunt, Eric Lange, David Morse, Jeremy Bobb, Peter Georgo, Michael Beasley, Calvin Dutton, Dominic Colón, Gregory Dann, Mike Speirs, David Hammond, Joshua Rivera, Antoni Corone, Johanna Day, Stephen C. Poland","Biography, Crime, Drama, Thriller",United States,English,Red Hour Films,https://www.imdb.com/title/tt6866266/?ref_=sr_i_565
True Blood,"(2008, 2014)",TV-MA,55.0,7.9,263000,1,Alan Ball,"Anna Paquin, Stephen Moyer, Sam Trammell, Ryan Kwanten, Chris Bauer, Nelsan Ellis, Carrie Preston, Rutina Wesley, Alexander Skarsgård, Deborah Ann Woll, Kristin Bauer, Jim Parrack, Todd Lowe, Lauren Bowles, Joe Manganiello, William Sanderson, Michael McMillian, Adina Porter","Drama, Fantasy, Mystery, Romance, Thriller",United States,"English, German, Swedish, Russian","Your Face Goes Here Entertainment, Home Box Office (HBO)",https://www.imdb.com/title/tt0844441/?ref_=sr_i_564
Ghosts,"(2021, None)",TV-PG,21.0,7.9,33000,0,"Joe Port, Joe Wiseman","Rose McIver, Utkarsh Ambudkar, Brandon Scott Jones, Danielle Pinnock, Richie Moriarty, Asher Grodman, Rebecca Wisocky, Devan Chandler Long, Román Zaragoza, Sheila Carrasco, John Hartman, Betsy Sodaro, Tristan D. Lalla, Arthur Holden, Stuart Fink, Nigel Downer, Christian Daoust, Caroline Aaron","Comedy, Fantasy","United Kingdom, United States",English,"Joe vs. Joe, Monumental Television, Them There",https://www.imdb.com/title/tt11379026/?ref_=sr_i_563
9-1-1,"(2018, None)",TV-14,43.0,7.9,51000,0,"Brad Falchuk, Tim Minear, Ryan Murphy","Angela Bassett, Peter Krause, Oliver Stark, Aisha Hinds, Kenneth Choi, Jennifer Love Hewitt, Ryan Guzman, Gavin McHugh, Corinne Massiah, Marcanthonee Reis, Rockmond Dunbar, Bryan Safi, Tracie Thoms, Declan Pratt, Chiquita Fuller, Anirudh Pisharody, Debra Christofferson, John Harlan Kim","Action, Drama, Thriller",United States,English,"Reamworks, Ryan Murphy Television, 20th Century Fox Television",https://www.imdb.com/title/tt7235466/?ref_=sr_i_562
Nobody Wants This,"(2024, None)",TV-MA,30.0,7.9,38000,0,Erin Foster,"Kristen Bell, Adam Brody, Justine Lupe, Timothy Simons, Jackie Tohn, Sherry Cola, Tovah Feldshuh, Paul Ben-Victor, Stephanie Faracy, Stephen Tobolowsky, Shiloh Bearman, Emily Arlook, Michael Hitchcock, D'Arcy Carden, Karan Soni, Leslie Grossman, Matt Oberg, Beth Triffon","Comedy, Romance",United States,English,"20th Television, 3 Arts Entertainment, Steve Levitan Productions",https://www.imdb.com/title/tt26933824/?ref_=sr_i_561
The Mechanism,"(2018, 2019)",TV-MA,41.0,8.0,37000,0,José Padilha,"Caroline Abras, Selton Mello, Enrique Diaz, Jonathan Haagensen, Otto Jr., Antonio Saboia, Lee Taylor, Osvaldo Mil, Susana Ribeiro, Giulio Lopes, Alessandra Colassanti, Arthur Kohl, Sura Berditchevsky, Karla Tenório, Tonio Carvalho, Denise Blasor, Emílio Orciollo Netto, Leonardo Medeiros","Crime, Drama, Thriller",Brazil,Portuguese,Zazen Produções,https://www.imdb.com/title/tt6873658/?ref_=sr_i_560
Paranormal,"(2020, None)",TV-14,45.0,8.0,75000,0,Amr Salama,"Razane Jammal, Karla Maatouk, Philip Shahbaz, Aya Samaha, Ahmed Amin, Reem Abd El Kader, Samma Ibrahim, Rushdi Al Shami, Batie Khalil, Sandy Issa Balat, Abdelsamee Abdallah, Adam Wahdan, Jamil Zraikat, Karim El Hakim, Ahmad Dash, Shaimaa Ibrahim, Mostafa Elmorsy, Carlton Caudle","Drama, Fantasy, Horror, Mystery, Thriller",Egypt,Arabic,"Film-Clinic, Netflix",https://www.imdb.com/title/tt12411074/?ref_=sr_i_559
The Keepers,"(2017, None)",TV-MA,60.0,8.0,26000,0,,"Gemma Hoskins, Abbie Schaub, Virginia Anzengruber, Jean Hargadon Wehner, Tom Nugent, Teresa Lancaster, Bob Erlandson, Gerry Koob, Lil Hughes Knipp, Marilyn Cesnik, Chris Centofanti, Beverly Wallace, Patricia Gilner, Donna Vondenbosch, Deb Silcox, Margaret, Don Hargadon, Ed Hargadon","Documentary, Crime, Mystery",United States,English,"Film 45, Tripod Media",https://www.imdb.com/title/tt6792200/?ref_=sr_i_558
Don't F**k with Cats: Hunting an Internet Killer,"(2019, None)",TV-MA,60.0,8.0,64000,1,,"Deanna Thompson, John Green, Claudette Hamlin, Anna Yourkin, Antonio Paradiso, Benjamin Xu, Joe Panz, Mike Nadeau, Henri, Joe Warmington, Ian Lafrenière, Romeo Salta, Kadir Anlayisli, Marc Lilge, Joel Watts, Alex Mihailovic, Alex Mihailovich","Documentary, Crime, Mystery",United Kingdom,English,RAW,https://www.imdb.com/title/tt11318602/?ref_=sr_i_557
DuckTales,"(1987, 1990)",TV-G,23.0,8.0,36000,0,Jymn Magon,"Alan Young, Russi Taylor, Terence McGovern, Chuck McCann, Frank Welker, Hal Smith, Joan Gerber, Hamilton Camp, June Foray, Peter Cullen, Brian Cummings, Tress MacNeille, Kathleen Freeman, Tony Anselmo, Will Ryan, Susan Blu, Miriam Flynn, Jim Cummings","Animation, Action, Adventure, Comedy, Family, Fantasy, Mystery, Sci-Fi","United States, Taiwan, Japan",English,Disney Television Animation,https://www.imdb.com/title/tt0092345/?ref_=sr_i_556
United States of Tara,"(2009, 2011)",TV-MA,30.0,8.0,26000,2,Diablo Cody,"Toni Collette, John Corbett, Rosemarie DeWitt, Keir Gilchrist, Brie Larson, Patton Oswalt, Michael J. Willett, Michael Hitchcock, Nate Corddry, Matthew Del Negro, Eddie Izzard, Andrew Lawrence, Bailey McAlevey, Rowan McAlevey, Valerie Mahaffey, Aaron Christian Howles, Keir O'Donnell, Zosia Mamet","Comedy, Drama, Romance",United States,English,DreamWorks Television,https://www.imdb.com/title/tt1001482/?ref_=sr_i_555
Patrick Melrose,"(2018, None)",TV-MA,60.0,8.0,33000,0,,"Benedict Cumberbatch, Jennifer Jason Leigh, Hugo Weaving, Sebastian Maltz, Jessica Raine, Prasanna Puwanarajah, Pip Torrens, Anna Madeley, Indira Varma, Blythe Danner, Gary Beadle, Morfydd Clark, Celia Imrie, Holliday Grainger, Eileen Walsh, John Standing, Marcus Smith, Dainton Anderson",Drama,"United Kingdom, United States",English,"Showtime Entertainment, Sky, Two Cities Television Ltd.",https://www.imdb.com/title/tt6586318/?ref_=sr_i_554
Unorthodox,"(2020, None)",TV-MA,53.0,8.0,94000,1,Anna Winger,"Shira Haas, Amit Rahav, Jeff Wilbusch, Alex Reid, Ronit Asheri, Delia Mayer, Dina Doron, David Mandelbaum, Gera Sandler, Lili Rosen, Aaron Altaras, Tamar Amit-Joseph, Langston Uibel, Safinaz Sattar, Felix Mayr, Aziz Dyab, Yousef 'Joe' Sweid, Isabel Schosnig",Drama,Germany,"German, English, Yiddish, Arabic, Polish, Russian","Studio Airlift, Real Film Berlin",https://www.imdb.com/title/tt9815454/?ref_=sr_i_553
Blackadder,"(1982, 1983)",TV-PG,30.0,8.0,42000,0,Richard Curtis,"Rowan Atkinson, Brian Blessed, Elspet Gray, Tim McInnerny, Tony Robinson, Robert East, Patrick Allen, Bert Parnaby, Roy Evans, David Nunn, Perry Benson, Alex Norton, Forbes Collins, Barbara Miller, Howard Lew Lewis, Natasha King, Stephen Frost, Peter Cook",Comedy,United Kingdom,English,"BBC Worldwide, British Broadcasting Corporation (BBC)",https://www.imdb.com/title/tt0084988/?ref_=sr_i_552
F Is for Family,"(2015, 2021)",TV-MA,30.0,8.0,42000,0,"Bill Burr, Michael Price","Bill Burr, Laura Dern, Justin Long, Debi Derryberry, Haley Reinhart, Mo Collins, Sam Rockwell, Trevor Devall, Phil Hendrie, Kevin Michael Richardson, David Koechner, Kevin P. Farley, Jamie Denbo, Joe Buck, Al Ducharme, Keith Ferguson, Eileen Fogarty, Michael Kenneth Williams","Animation, Comedy, Drama","France, Canada, United States",English,"Big Jump Entertainment, Big Jump Productions, Gaumont Animation",https://www.imdb.com/title/tt4326894/?ref_=sr_i_551
River,"(2015, None)",TV-MA,60.0,8.0,28000,0,Abi Morgan,"Stellan Skarsgård, Nicola Walker, Adeel Akhtar, Lesley Manville, Owen Teale, Georgina Rich, Eddie Marsan, Turlough Convery, Steve Munroe, Sorcha Cusack, Michael Maloney, Steve Nicolson, Jim Norton, Josef Altin, Peter Bankolé, Pippa Bennett-Warner, Stefan Kalipha, Franz Drameh","Crime, Drama, Mystery",United Kingdom,"English, Arabic, Swedish, Romanian, French",Kudos Film and Television,https://www.imdb.com/title/tt4258440/?ref_=sr_i_550
Rise of Empires: Ottoman,"(2020, 2022)",TV-MA,45.0,8.0,38000,0,,"Cem Yigit Uzümoglu, Tuba Büyüküstün, Alp Ilkman, Ushan Çakir, Charles Dance, Birkan Sokullu, Tommaso Basili, Osman Sonant, Selim Bayraktar, Damla Sönmez, Ilayda Akdogan, Tugrul Tulek, Luca Marrocco, Yigit Kagan Yazici, Taro Emir Tekin, Deniz Ince, Coskun Altunbay, Masallah Baris","Documentary, Drama, History, War",United States,"Turkish, English, Latin, Arabic, Greek, Italian, Romanian, Serbo-Croatian","Karga Seven Pictures, Netflix Studios, STX Entertainment",https://www.imdb.com/title/tt9244578/?ref_=sr_i_549
Vice Principals,"(2016, 2017)",TV-MA,30.0,8.0,33000,0,"Jody Hill, Danny McBride","Danny McBride, Walton Goggins, Sheaun McKinney, Georgia King, Shea Whigham, Maya G. Love, Edi Patterson, Busy Philipps, Ashley Rae Spillers, James M. Connor, Kimberly Hebert Gregory, Susan Park, June Kyoto Lu, Jennifer Gatti, Dale Dickey, Mike O'Gorman, Lucius Dillon, Brian Howe",Comedy,United States,English,"Home Box Office (HBO), Rough House Pictures",https://www.imdb.com/title/tt3766376/?ref_=sr_i_548
Sneaky Pete,"(2015, 2019)",TV-MA,60.0,8.0,42000,0,"Bryan Cranston, David Shore","Giovanni Ribisi, Marin Ireland, Shane McRae, Libe Barer, Peter Gerety, Margo Martindale, Jay O. Sanders, Jacob Pitts, Justine Cotsonas, Alison Wright, Ethan Embry, Jeté Laurence, Michael Drayer, Efrat Dor, Joseph Lyle Taylor, Victor Williams, Kevin Chapman, Jane Adams","Comedy, Crime, Drama",United States,English,"Moon Shot Entertainment, Amazon Studios, Sony Pictures Television",https://www.imdb.com/title/tt5011816/?ref_=sr_i_547
The Pillars of the Earth,"(2010, None)",TV-MA,59.0,8.0,34000,1,,"Ian McShane, Matthew Macfadyen, Eddie Redmayne, Hayley Atwell, Sarah Parish, Natalia Wörner, Anatole Taubman, John Pielmeier, Robert Bathurst, Clive Wood, Sam Claflin, Liam Garrigan, David Oakes, Tony Curran, Donald Sutherland, Alison Pill, Gordon Pinsent, László Áron","Drama, Romance, Thriller, War","Germany, Canada, United Kingdom, Hungary","English, French","Tandem Communications, Muse Entertainment Enterprises, Scott Free Productions",https://www.imdb.com/title/tt1453159/?ref_=sr_i_546
