Title,Years,Certification,Runtime,Rating,Number of Votes,Emmys,Creators,Actors,Genres,Countries of origins,Languages,Production companies,Link
Queen Cleopatra,"(2023, None)",TV-14,45.0,1.2,86000,0,,"Jada Pinkett Smith, Adele James, Craig Russell, John Partridge, Andira Crichlow, Kaysha Woollery, Laya Lewis, Callum Balmforth, Louis Emerick, Phillip E. Walker, Michael Greco, Greg Lockett, James Marlowe, Simon Kunz, James O'Driscoll, Shelley Haley, Debora Heard, Islam Issa","Documentary, Drama, History",United Kingdom,English,Nutopia,https://www.imdb.com/title/tt27528139/?ref_=sr_i_1138
Velma,"(2023, 2024)",TV-MA,25.0,1.6,80000,0,Charlie Grandy,"Mindy Kaling, Glenn Howerton, Sam Richardson, Constance Wu, Jane Lynch, Melissa Fumero, Russell Peters, Wanda Sykes, Sarayu Blue, Kari Wahlgren, Fortune Feimster, Gary Cole, Frank Welker, Kulap Vilaysack, Nicole Byer, Cherry Jones, Sara Ramirez, Debby Ryan","Animation, Adventure, Comedy, Crime, Horror, Mystery","United States, South Korea",English,"Charlie Grandy Productions, Kaling International, 3 Arts Entertainment",https://www.imdb.com/title/tt14153790/?ref_=sr_i_1137
Keeping Up with the Kardashians,"(2007, 2021)",TV-14,44.0,2.9,32000,0,"Ryan Seacrest, Eliot Goldberg","Khloé Kardashian, Kim Kardashian, Kourtney Kardashian, Kris Jenner, Kendall Jenner, Kylie Jenner, Caitlyn Jenner, Scott Disick, Rob Kardashian, Mason Dash Disick, Stephanie Suganami, Ye, Malika Haqq, Lamar Odom, Penelope Scotland Disick, Jonathan Cheban, North West, Corey Gamble","Family, Reality-TV",United States,"English, Spanish","Bunim-Murray Productions (BMP), Ryan Seacrest Productions",https://www.imdb.com/title/tt1086761/?ref_=sr_i_1136
Batwoman,"(2019, 2022)",TV-14,45.0,3.6,47000,0,Caroline Dries,"Camrus Johnson, Rachel Skarsten, Meagan Tandy, Nicole Kang, Dougray Scott, Javicia Leslie, Rachel Maddow, Ruby Rose, Allison Riley, Sam Littlefield, Nathan Owens, Robin Givens, Christina Wolfe, Jesse Hutch, Elizabeth Anweis, Nick Creegan, Peter Outerbridge, Gracyn Shinyei","Action, Adventure, Crime, Drama, Sci-Fi",United States,English,"Berlanti Productions, DC Entertainment, Warner Bros. Television",https://www.imdb.com/title/tt8712204/?ref_=sr_i_1135
The Acolyte,"(2024, None)",TV-14,35.0,4.1,125000,0,Leslye Headland,"Lee Jung-jae, Amandla Stenberg, Manny Jacinto, Charlie Barnett, Dafne Keen, Rebecca Henderson, Joonas Suotamo, Leah Brady, Jodie Turner-Smith, Dean-Charles Chapman, Carrie-Anne Moss, Lauren Brady, Margarita Levieva, Harry Trevaldwyn, Amy Tsang, Abigail Thorn, Saskia Allen, Deborah Rosan","Action, Adventure, Drama, Fantasy, Mystery, Sci-Fi, Thriller",United States,English,"Lucasfilm, Disney+, The Walt Disney Company",https://www.imdb.com/title/tt12262202/?ref_=sr_i_1134
Resident Evil,"(2022, None)",TV-MA,60.0,4.2,47000,0,,"Ella Balinska, Tamara Smart, Siena Agudong, Adeline Rudolph, Paola Núñez, Lance Reddick, Connor Gosatti, Anthony Oseyemi, Ahad Raza Mir, Pedro De Tavira, Ella Zieglmeier, Turlough Convery, Emily Child, George Jackos, Ayushi Chhabra, Mpho Osei Tutu, Edward J. Pepperell, Kristin Trisha","Action, Horror, Sci-Fi, Thriller",Germany,English,"Constantin Television, Moonlighting Films",https://www.imdb.com/title/tt9660182/?ref_=sr_i_1133
The Idol,"(2023, None)",TV-MA,276.0,4.4,113000,1,"Reza Fahim, Sam Levinson, The Weeknd","The Weeknd, Lily-Rose Depp, Suzanna Son, Troye Sivan, Jane Adams, Jennie Kim, Rachel Sennott, Hari Nef, Moses Sumney, Da'Vine Joy Randolph, Ramsey, Hank Azaria, Mitch Modes, Bianca Ghezzi, Eli Roth, Sophie Mudd, Montay Romero, Kat Cheng","Drama, Music",United States,English,"A24 Television, A24, BRON Studios",https://www.imdb.com/title/tt14954666/?ref_=sr_i_1132
Tandav,"(2021, None)",TV-14,30.0,4.6,61000,0,Ali Abbas Zafar,"Saif Ali Khan, Dimple Kapadia, Mohd. Zeeshan Ayyub, Sunil Grover, Kritika Kamra, Sarah Jane Dias, Tasneem Khan, Kritikka Avasthi, Vikhyat Gulati, Bhoomika Meena, Niharika Kundu, Bhavna Choudhary, Gaurav Parajuli, Jatin Sharma, Indra Mohan Singh, Kunal Gupta, Latin Ghai, Dino Morea","Drama, Thriller",India,Hindi,"Offside Entertainment, NSA Picture, AAZ Films",https://www.imdb.com/title/tt11117570/?ref_=sr_i_1131
Racket Boys,"(2021, None)",TV-14,80.0,4.7,28000,0,,"Kim Sang-kyung, Oh Na-ra, Tang Joon-sang, Son Sang-yeon, Choi Hyun-wook, Kim Kang-hoon, Lee Jae-in, Lee Ji-won, Park Ok-chool, Woo Hyeon, Shin Jeong-geun, Cha Mi-kyung, Ahn Se-bin, Kim Min-Ki, Park Hyo-ju, Jeong Mi-Seong, Shin Cheol-jin, Choi Dae-hoon","Comedy, Drama, Sport",South Korea,Korean,"PAN Entertainment, Studio S",https://www.imdb.com/title/tt14482414/?ref_=sr_i_1130
Inhumans,"(2017, None)",TV-PG,43.0,4.9,29000,0,Scott Buck,"Anson Mount, Serinda Swan, Ken Leung, Eme Ikwuakor, Isabelle Cornish, Ellen Woglom, Iwan Rheon, Sonya Balmores, Henry Ian Cusick, Ari Dalbert, Krista Alvarez, Aaron Hendry, Faleolo Alailima, Bridger Zadina, Ptolemy Slocum, Lofton Shaw, Chad James Buchanan, Mike Moh","Action, Adventure, Sci-Fi",United States,English,"ABC Signature, Disney-ABC Domestic Television, IMAX",https://www.imdb.com/title/tt4154858/?ref_=sr_i_1129
The Witcher: Blood Origin,"(2022, None)",TV-MA,50.0,4.9,46000,0,Declan De Barra,"Sophia Brown, Laurence O'Fuarain, Mirren Mack, Lenny Henry, Jacob Collins-Levy, Zach Wyatt, Lizzie Annis, Huw Novelli, Francesca Mills, Amy Murray, Minnie Driver, Michelle Yeoh, Samuel Blenkin, Hiftu Quasem, Joey Batey, Dylan Moran, Nathaniel Curtis, Ella Schrey-Yeats","Action, Adventure, Drama, Fantasy, Mystery","Poland, United States, United Kingdom, Thailand",English,"Hivemind, Netflix, Platige Films",https://www.imdb.com/title/tt12785720/?ref_=sr_i_1128
Indian Police Force,"(2024, None)",,0.0,5.0,58000,0,Rohit Shetty,"Sidharth Malhotra, Vivek Oberoi, Shilpa Shetty Kundra, Sharad Kelkar, Isha Talwar, Mayyank Taandon, Mukesh Rishi, Rituraj Singh, Mrinal Kulkarni, Shweta Tiwari, Nikitin Dheer, Vaidehi Parshurami, Pradeep Kabra, Lalit Parimoo, Suchitra Bandekar, Vipul Deshpande, Sooraj Ohri, Karanvir Malhotra","Action, Crime, Drama, Thriller",India,Hindi,"Reliance Entertainment, Rohit Shetty Picturez",https://www.imdb.com/title/tt19768024/?ref_=sr_i_1127
She-Hulk: Attorney at Law,"(2022, None)",TV-14,32.0,5.2,195000,0,Jessica Gao,"Tatiana Maslany, Ginger Gonzaga, Malia Arrayah, Jameela Jamil, Steve Coulter, Renée Elise Goldsberry, Josh Segarra, Tim Roth, Mark Linn-Baker, Jon Bass, Nicholas Cirillo, Drew Matthews, Justin Eaton, Mark Ruffalo, Tess Malis Kincaid, Trevor Salter, Benedict Wong, Nick Gomez","Action, Adventure, Comedy, Drama, Sci-Fi",United States,English,"Marvel Studios, The Walt Disney Company",https://www.imdb.com/title/tt10857160/?ref_=sr_i_1126
Another Life,"(2019, 2021)",TV-MA,43.0,5.3,39000,0,Aaron Martin,"Katee Sackhoff, Samuel Anderson, A.J. Rivera, JayR Tinaco, Justin Chatwin, Elizabeth Faith Ludlow, Helen King, Alexander Eling, Lina Renna, Blu Hunt, Alex Ozerov-Meyer, Tongayi Chirisa, Jake Abel, Dillon Casey, Selma Blair, Parveen Dosanjh, Kurt Yaeger, Barbara Williams","Adventure, Drama, Mystery, Sci-Fi, Thriller",United States,English,,https://www.imdb.com/title/tt8369840/?ref_=sr_i_1125
King the Land,"(2023, None)",TV-14,60.0,5.3,136000,0,,"Lee Jun-ho, Im Yoon-ah, Lee Ji-hye, Go Won-Hee, Kim Ga-eun, Ahn Se-ha, Sun-young Kim, Kong Ye-ji, Kim Young-ok, Kim Jae-Won, Son Byung-ho, Kim Min-ah, Kim Dong-ha, Min Ku-kyung, Ahn Woo-yeon, Anupam Tripathi, Lee Kyung-sung, Lee Ja-ryeong","Comedy, Drama, Romance",South Korea,"Korean, English, Russian","NPIO Entertainment, SLL",https://www.imdb.com/title/tt26693803/?ref_=sr_i_1124
7th Heaven,"(1996, 2007)",TV-G,60.0,5.3,27000,0,Brenda Hampton,"Stephen Collins, Catherine Hicks, Jessica Biel, Beverley Mitchell, Happy, Mackenzie Rosman, David Gallagher, Barry Watson, Lorenzo Brino, Nikolas Brino, George Stults, Tyler Hoechlin, Adam LaVorgna, Christopher Michael, Rachel Blanchard, Ashlee Simpson, Jeremy London, Scotty Leavenworth","Comedy, Drama, Family, Romance",United States,English,Spelling Television,https://www.imdb.com/title/tt0115083/?ref_=sr_i_1123
The Mist,"(2017, None)",TV-14,42.0,5.4,29000,0,Christian Torpe,"Morgan Spector, Alyssa Sutherland, Gus Birney, Danica Curcic, Okezie Morro, Luke Cosgrove, Darren Pettie, Russell Posner, Frances Conroy, Irene Bedard, Deborah Allen, Holly Deveaux, Andrea Lee Norwood, Romaine Waite, Isiah Whitlock Jr., Bill Carr, Murlane Carew, Nabeel El Khafif","Drama, Horror, Mystery, Sci-Fi, Thriller","Canada, United States",English,"Magic Rock Productions, TWC-Dimension",https://www.imdb.com/title/tt5639976/?ref_=sr_i_1122
Hannah Montana,"(2006, 2011)",TV-G,23.0,5.4,45000,0,"Richard Correll, Barry O'Brien, Michael Poryes","Miley Cyrus, Emily Osment, Jason Earles, Billy Ray Cyrus, Mitchel Musso, Monica Pinto, Moises Arias, Shanica Knowles, Anna Maria Perez de Tagle, Scarlet Rowe, Hiromi Dames, Cody Linley, Bobby Waddington, Morgan York, Tammin Sursok, Frances Callier, Greg Baker, Hayley Chase","Comedy, Family, Music",United States,English,"It's a Laugh Productions, Michael Poryes Productions, Disney Channel",https://www.imdb.com/title/tt0493093/?ref_=sr_i_1121
Baywatch,"(1989, 2001)",TV-PG,60.0,5.5,31000,0,"Michael Berk, Gregory J. Bonann, Douglas Schwartz","David Hasselhoff, Pamela Anderson, Yasmine Bleeth, Jeremy Jackson, Michael Newman, Chris Fiore, Gregory Alan Williams, Alexandra Paul, Michael Bergin, David Chokachi, David Charvet, Gena Lee Nolin, Kelly Packard, Gregory J. Barnett, Jaason Simmons, José Solano, Brooke Burns, Billy Warlock","Action, Adventure, Crime, Drama, Romance",United States,English,"GTG Entertainment, Pearson All-American Television, The Baywatch Company",https://www.imdb.com/title/tt0096542/?ref_=sr_i_1120
Four More Shots Please,"(2019, 2022)",TV-MA,60.0,5.6,55000,0,Rangita Pritish Nandy,"Sayani Gupta, Kirti Kulhari, Gurbani, Maanvi Gagroo, Prateik Patil Babbar, Neil Bhoopalam, Jiya Lakhiani, Lisa Ray, Simone Singh, Amrita Puri, Milind Soman, Sameer Kochhar, Jaideep Singh, Shivam Rao, Rajeev Siddhartha, Rohan Mehra, Ankur Rathee, Fahad Samar","Comedy, Drama, Romance",India,"Hindi, English",Pritish Nandy Communications (PNC),https://www.imdb.com/title/tt8242548/?ref_=sr_i_1119
Anne Boleyn,"(2021, None)",TV-MA,60.0,5.6,28000,0,,"Jodie Turner-Smith, Kris Hitchen, Thalissa Teixeira, Barry Ward, Isabella Laughland, Paapa Essiedu, Anna Brewster, Amanda Burton, Lola Petticrew, Kaila Douglin, Mark Stanley, Phoenix Di Sebastiani, Turlough Convery, James Harkness, Anna Mawn, Aoife Hinds, Abhin Galeya, Jamael Westman","Drama, History",United Kingdom,English,"Channel 5 Television, Fable Pictures, Sony Pictures Television Production UK",https://www.imdb.com/title/tt13406036/?ref_=sr_i_1118
Masters of the Universe: Revelation,"(2021, None)",TV-PG,25.0,5.6,29000,0,,"Sarah Michelle Gellar, Lena Headey, Mark Hamill, Tiffany Smith, Chris Wood, Liam Cunningham, Stephen Root, Diedrich Bader, Kevin Michael Richardson, Susan Eisenberg, Griffin Newman, Henry Rollins, Alicia Silverstone, Justin Long, Tony Todd, Dee Bradley Baker, Jason Mewes, Phil LaMarr","Animation, Action, Adventure, Fantasy, Sci-Fi",United States,English,"Mattel, Mattel Television",https://www.imdb.com/title/tt10826054/?ref_=sr_i_1117
The Cleveland Show,"(2009, 2013)",TV-14,22.0,5.6,43000,0,"Richard Appel, Mike Henry, Seth MacFarlane","Mike Henry, Sanaa Lathan, Kevin Michael Richardson, Jason Sudeikis, Reagan Gomez-Preston, Seth MacFarlane, Aseem Batra, Nickie Bryar, John Viener, Glenn Howerton, Alec Sulkin, Jamie Kennedy, Will Forte, David Lynch, Arianna Huffington, Alex Borstein, Craig Robinson, Frances Callier","Animation, Adventure, Comedy","United States, South Korea",English,"Persons Unknown Productions, Happy Jack Productions, Fuzzy Door Productions",https://www.imdb.com/title/tt1195935/?ref_=sr_i_1116
Sex/Life,"(2021, 2023)",TV-MA,45.0,5.6,32000,0,Stacy Rukeyser,"Sarah Shahi, Mike Vogel, Adam Demos, Margaret Odette, Phoenix Reich, Jonathan Sadowski, Joyce Rivera, Li Jun Li, Amber Goldfarb, Cleo Anthony, Darius Homayoun, Meghan Heffern, Emilia Rose Alexandre, Wallis Day, Dylan Bruce, Craig Bierko, Hannah Galway, David Collins","Comedy, Drama, Romance",United States,English,"Demilo Films, Demilo Productions",https://www.imdb.com/title/tt10839422/?ref_=sr_i_1115
Willow,"(2022, 2023)",TV-14,0.0,5.7,34000,0,Jonathan Kasdan,"Ruby Cruz, Ellie Bamber, Tony Revolori, Erin Kellyman, Amar Chadha-Patel, Warwick Davis, Dempsey Bryk, Joonas Suotamo, Claudia Hughes, Joanne Whalley, Rosabell Laurenti Sellers, Ralph Ineson, Daniel Naprous, Vitas Le Bas, Graham Hughes, Sifiso Mazibuko, Kenny Knight, Derek Horsham","Action, Adventure, Drama, Fantasy, Romance",United States,English,"Imagine Entertainment, Lucasfilm Television, Lucasfilm",https://www.imdb.com/title/tt10278918/?ref_=sr_i_1114
Teen Titans Go!,"(2013, None)",TV-PG,10.0,5.7,26000,0,"Michael Jelenic, Aaron Horvath","Greg Cipes, Scott Menville, Khary Payton, Hynden Walch, Tara Strong, Lauren Tom, Kevin Michael Richardson, Fred Tatasciore, John DiMaggio, Peter Rida Michail, Ozioma Akagha, Larry Kenney, Cree Summer, Alexander Polinsky, Flula Borg, Rachel Dratch, Robert Morse, David Kaye","Animation, Short, Action, Adventure, Comedy, Crime, Drama, Family, Fantasy, Sci-Fi",United States,English,"DC Entertainment, Warner Bros. Animation",https://www.imdb.com/title/tt2771780/?ref_=sr_i_1113
How I Met Your Father,"(2022, 2023)",TV-14,24.0,5.7,27000,4,"Isaac Aptaker, Elizabeth Berger","Hilary Duff, Christopher Lowell, Francia Raisa, Suraj Sharma, Tom Ainsley, Tien Tran, Kim Cattrall, Josh Peck, Ashley Reyes, Aby James, Leighton Meester, Stony Blyden, Daniel Augustin, Michael Cimino, Paget Brewster, Clark Gregg, John Corbett, Meaghan Rath","Comedy, Drama",United States,English,"20th Television, Bays Thomas Productions, Hulu Originals",https://www.imdb.com/title/tt14500082/?ref_=sr_i_1112
And Just Like That...,"(2021, None)",TV-MA,40.0,5.7,40000,0,"Michael Patrick King, Darren Star","Sarah Jessica Parker, Cynthia Nixon, Kristin Davis, Mario Cantone, Sara Ramirez, Evan Handler, Sarita Choudhury, Nicole Ari Parker, Karen Pittman, Alexa Swinton, Cathy Ang, Niall Cunningham, Chris Jackson, David Eigenberg, Bobby Lee, LeRoy McClain, Cree, Alexander Bello","Comedy, Drama, Romance",United States,English,"HBO Entertainment, Home Box Office (HBO), Michael Patrick King Productions",https://www.imdb.com/title/tt13819960/?ref_=sr_i_1111
The Stand,"(2020, 2021)",TV-MA,57.0,5.7,31000,0,"Josh Boone, Benjamin Cavell","Whoopi Goldberg, Alexander Skarsgård, James Marsden, Odessa Young, Gordon Cormier, Amber Heard, Jovan Adepo, Owen Teague, Irene Bedard, Brad William Henke, Nat Wolff, Henrique Zaga, Greg Kinnear, Nicholas Lea, Eion Bailey, Katherine McNamara, Olivia Cheng, Fiona Dourif","Adventure, Drama, Fantasy, Horror, Sci-Fi, Thriller",United States,English,"Vertigo Entertainment, CBS Television Studios, Mosaic",https://www.imdb.com/title/tt1831804/?ref_=sr_i_1110
Secret Invasion,"(2023, None)",TV-14,45.0,5.9,81000,0,Kyle Bradstreet,"Samuel L. Jackson, Emilia Clarke, Don Cheadle, Kingsley Ben-Adir, Killian Scott, Ben Mendelsohn, Olivia Colman, Charlayne Woodard, Samuel Adewunmi, Katie Finneran, Irmena Chichikova, Dermot Mulroney, Michael Epp, Christopher McDonald, Anna Madeley, Mark Bazeley, Mark Lewis, Martin Freeman","Action, Adventure, Drama, Mystery, Sci-Fi, Thriller",United States,"French, Finnish, Russian, English","Marvel Studios, The Walt Disney Company",https://www.imdb.com/title/tt13157618/?ref_=sr_i_1109
Cursed,"(2020, None)",TV-MA,60.0,6.0,34000,0,"Frank Miller, Tom Wheeler","Katherine Langford, Devon Terrell, Gustaf Skarsgård, Daniel Sharman, Sebastian Armesto, Lily Newmark, Shalom Brune-Franklin, Peter Mullan, Emily Coates, Billy Jenkins, Matt Stokoe, Jasper Jacob, Adaku Ononogbo, Clive Russell, Ashley Bannerman, Polly Walker, Sofia Oxenham, Jóhannes Haukur Jóhannesson","Adventure, Drama, Fantasy",United States,English,"Arcanum, CAMA Asset Storage &amp; Recycling, Netflix",https://www.imdb.com/title/tt8210856/?ref_=sr_i_1108
Joey,"(2004, 2006)",TV-14,22.0,6.0,45000,0,"Shana Goldberg-Meehan, Scott Silveri","Matt LeBlanc, Paulo Costanzo, Drea de Matteo, Andrea Anders, Jennifer Coolidge, Ben Falcone, Miguel A. Núñez Jr., Adam Goldberg, Alex Ball, Tommy Perna, Mädchen Amick, Matt Letscher, Gregory Harrison, Matthew Mullany, Simon Helberg, Lucy Liu, Richard Ruccolo, Danneel Ackles","Comedy, Romance",United States,English,"Silver and Gold Productions, Bright-San Productions, Warner Bros. Television",https://www.imdb.com/title/tt0375355/?ref_=sr_i_1107
Echo,"(2023, 2024)",TV-MA,42.0,6.0,41000,0,Marion Dayre,"Alaqua Cox, Chaske Spencer, Tantoo Cardinal, Graham Greene, Devery Jacobs, Cody Lightning, Morningstar Angeline, Dannie McCallum, Braydee Cardinal, Vincent D'Onofrio, Darnell Besaw, Katarina Ziervogel, Isabella Madrigal, Wren Zhawenim Gotts, Panther Tiwa, Thosh Collins, Seth Fairchild, Zahn McClarnon","Action, Adventure, Crime, Drama, Mystery, Sci-Fi",United States,"English, American Sign Language","Marvel Studios, 20th Television",https://www.imdb.com/title/tt13966962/?ref_=sr_i_1106
Black Lightning,"(2018, 2021)",TV-14,43.0,6.1,28000,0,Salim Akil,"Cress Williams, Nafessa Williams, Christine Adams, Marvin Jones III, James Remar, China Anne McClain, Jordan Calloway, Damon Gupton, Chantal Thuy, William Catlett, Bill Duke, Christopher Ammanuel, Clifton Powell, Jennifer Riker, Jahking Guillory, Katy O'Brian, Skye P. Marshall, Wallace Smith","Action, Drama, Sci-Fi",United States,English,"Berlanti Productions, DC Entertainment, Warner Bros. Television",https://www.imdb.com/title/tt6045840/?ref_=sr_i_1105
The Langoliers,"(1995, None)",PG-13,0.0,6.1,32000,0,,"Patricia Wettig, Dean Stockwell, Tom Holland, Kate Maberly, Mark Lindsay Chapman, Julie Arnold Lisnet, Frankie Faison, Baxter Harris, Michael Louden, Christopher Collet, Kimber Riddle, Kymberly Dakin, David Morse, Bronson Pinchot, David Forrester, Chris Hendrie, Jennifer Nichole Porter, John Griesemer","Horror, Mystery, Sci-Fi, Thriller",United States,English,"Laurel Entertainment Inc., Spelling Films International, Worldvision",https://www.imdb.com/title/tt0112040/?ref_=sr_i_1104
Ms. Marvel,"(2022, None)",TV-PG,45.0,6.2,123000,1,,"Iman Vellani, Matt Lintz, Zenobia Shroff, Yasmeen Fletcher, Rish Shah, Mohan Kapur, Saagar Shaikh, Samina Ahmed, Nimra Bucha, Alysia Reiner, Anjali Bhimani, Sophia Mahmud, Aramis Knight, Arian Moayed, Laurel Marsden, Laith Nakli, Adaku Ononogbo, Travina Springer","Action, Adventure, Comedy, Crime, Drama, Family, Fantasy, Mystery, Sci-Fi",United States,English,"Marvel Studios, The Walt Disney Company",https://www.imdb.com/title/tt10857164/?ref_=sr_i_1103
90210,"(2008, 2013)",TV-14,60.0,6.2,46000,0,"Jeff Judah, Gabe Sachs, Darren Star","Shenae Grimes-Beech, Tristan Mack Wilds, AnnaLynne McCord, Jessica Stroup, Michael Steger, Jessica Lowndes, Matt Lanter, Trevor Donovan, Lori Loughlin, Ryan Eggold, Gillian Zinser, Rob Estes, Josh Zuckerman, Dustin Milligan, Sara Foster, Jennie Garth, Justin Deeley, Zachary Ray Sherman","Comedy, Drama, Romance",United States,English,"Sachs/Judah Productions, CBS Productions, CBS Television Studios",https://www.imdb.com/title/tt1225901/?ref_=sr_i_1102
Invasion,"(2021, 2025)",TV-MA,60.0,6.2,48000,0,"Simon Kinberg, David Weil","Golshifteh Farahani, Shioli Kutsuna, Shamier Anderson, Billy Barratt, Azhy Robertson, Tara Moayedi, India Brown, Paddy Holland, Cache Vanderpuye, Enver Gjokaj, Nedra Marie Taylor, Firas Nassar, Daisuke Tsuji, Naian González Norvind, Rinko Kikuchi, Shingo Usami, Olivia-Mai Barrett, Ruby Siddle","Drama, Fantasy, Sci-Fi",United States,English,"Genre Films, K Films, Platform One Media",https://www.imdb.com/title/tt9737326/?ref_=sr_i_1101
Supergirl,"(2015, 2021)",TV-PG,43.0,6.2,131000,0,"Ali Adler, Greg Berlanti, Andrew Kreisberg","Melissa Benoist, Chyler Leigh, David Harewood, Katie McGrath, Mehcad Brooks, Jeremy Jordan, Jesse Rath, Nicole Maines, Chris Wood, Azie Tesfai, Andrea Brooks, Julie Gonzalo, Staz Nair, Calista Flockhart, Floriana Lima, Odette Annable, Brenda Strong, Sam Witwer","Action, Adventure, Drama, Sci-Fi",United States,English,"Berlanti Productions, Warner Bros. Television",https://www.imdb.com/title/tt4016454/?ref_=sr_i_1100
Citadel,"(2023, None)",TV-14,41.0,6.2,35000,0,"Josh Appelbaum, Bryan Oh, David Weil","Richard Madden, Priyanka Chopra Jonas, Stanley Tucci, Lesley Manville, Ashleigh Cummings, Roland Møller, Osy Ikhile, Caoilinn Springall, Moira Kelly, Nikki Amuka-Bird, Gráinne Good, Leo Woodall, Simon Kim, Leo Ashizawa, Laëtitia Eïdo, Sara Martins, Kineta Kunutu, Olegar Fedoro","Action, Drama, Thriller",United States,English,"AGBO, Amazon Studios, Midnight Radio",https://www.imdb.com/title/tt9794044/?ref_=sr_i_1099
Heeramandi: The Diamond Bazaar,"(2024, None)",TV-MA,60.0,6.3,28000,0,,"Manisha Koirala, Sonakshi Sinha, Aditi Rao Hydari, Richa Chadha, Sharmin Segal, Sanjeeda Sheikh, Anuj Sharma, Jason Shah, Taha Shah Badussha, Indresh Malik, Jayati Bhatia, Abhishek Deswal, Nivedita Bhargava, Astha Mittal, Fardeen Khan, Mark Bennington, David Michael Harrison, Shruti Sharma","Drama, History, Romance",India,Hindi,Bhansali Productions,https://www.imdb.com/title/tt15204292/?ref_=sr_i_1098
The Rain,"(2018, 2020)",TV-MA,45.0,6.3,43000,0,"Jannik Tai Mosholt, Christian Potalivo, Esben Toft Jacobsen","Alba August, Lucas Lynggaard Tønnesen, Mikkel Boe Følsgaard, Lukas Løkken, Natalia Rosminati, Sonny Lindberg, Johannes Kuhnke, Jessica Dinnage, Natalie Madueño, Clara Rosager, Evin Ahmad, Angela Bundalovic, Rasmus Hammerich, Rex Leonard, Cecilia Loffredo, Bertil De Lorenzi, Michael Boegebjerg, Lars Simonsen","Drama, Sci-Fi, Thriller","Denmark, United States",Danish,Miso Film,https://www.imdb.com/title/tt6656238/?ref_=sr_i_1097
Pieces of Her,"(2022, None)",TV-MA,52.0,6.3,34000,0,Charlotte Stoudt,"Toni Collette, Bella Heathcote, Jessica Barden, Joe Dempsie, Omari Hardwick, David Wenham, Terry O'Quinn, Gil Birmingham, Catherine McClements, Jacob Scipio, Calum Worthy, Nicholas Burton, Ellie Lang, Ewen Leslie, Mia Artemis, Jeremy Waters, Gregory Matchett, Aaron Jeffery","Crime, Drama, Mystery, Thriller","United States, Australia",English,"Fifth Season, Made Up Stories",https://www.imdb.com/title/tt9170236/?ref_=sr_i_1096
That '90s Show,"(2023, 2024)",TV-14,30.0,6.3,29000,0,"Gregg Mettler, Bonnie Turner, Lindsey Turner","Kurtwood Smith, Debra Jo Rupp, Callie Haverda, Ashley Aufderheide, Mace Coronel, Reyn Doi, Sam Morelos, Maxwell Acee Donovan, Andrea Anders, Don Stark, Laura Prepon, Anthony Turpel, Wilmer Valderrama, Tommy Chong, Kira Kosarin, Niles Fitch, Jason Mewes, Kevin Smith","Comedy, Drama, Romance",United States,English,"Carsey-Werner Company, Netflix",https://www.imdb.com/title/tt15591076/?ref_=sr_i_1095
American Horror Stories,"(2021, None)",TV-MA,45.0,6.3,28000,0,"Brad Falchuk, Ryan Murphy","Sierra McCormick, Paris Jackson, Merrin Dungey, Selena Sloan, Ashley Carter, Valerie Loo, Jessica Barden, Devyn LaBella, Troy Castaneda, Cody Fern, Matt Bomer, Nico Greetham, Gavin Creel, Dyllon Burnside, Seth Gabel, Cameron Cowperthwaite, Kaia Gerber, Jeff Hiller","Drama, Horror, Mystery, Thriller",United States,English,"20th Television, Brad Falchuk Teley-Vision, FX Productions",https://www.imdb.com/title/tt12306692/?ref_=sr_i_1094
Dear White People,"(2017, 2021)",TV-MA,30.0,6.4,27000,0,Justin Simien,"Logan Browning, Brandon P Bell, DeRon Horton, Antoinette Robertson, John Patrick Amedori, Ashley Blaine Featherson-Jenkins, Marque Richardson, Jemar Michael, Giancarlo Esposito, Courtney Sauls, Nia Jervier, Caitlin Carver, Wyatt Nash, Obba Babatundé, Erich Lane, Nicholas Anthony Reid, Brandon Black, Wade F. Wilson","Comedy, Drama",United States,English,"SisterLee Productions, Culture Machine, Code Red Productions",https://www.imdb.com/title/tt5707802/?ref_=sr_i_1093
The Protector,"(2018, 2020)",TV-MA,45.0,6.4,38000,0,Binnur Karaevli,"Çagatay Ulusoy, Hazar Ergüçlü, Okan Yalabik, Burçin Terzioglu, Ayça Aysin Turan, Funda Eryigit, Emily Goss, Emre Mutlu, Bige Önal, Halit Özgür Sari, Yurdaer Okur, Earl Baylon, Mehmet Kurtulus, Saygin Soysal, Boran Kuzum, Engin Öztürk, Taner Ölmez, Çigdem Selisik Onat","Action, Adventure, Drama, Fantasy, Romance, Sci-Fi, Thriller",Turkey,Turkish,"O3 Medya, Netflix Studios, Netflix",https://www.imdb.com/title/tt7668518/?ref_=sr_i_1092
Dharma &amp; Greg,"(1997, 2002)",TV-PG,30.0,6.4,33000,0,"Chuck Lorre, Dottie Dartland Zicklin","Jenna Elfman, Thomas Gibson, Joel Murray, Mimi Kennedy, Alan Rachins, Mitchell Ryan, Susan Sullivan, Shae D'lyn, Helen Greenberg, Lillian Hurst, Susan Chuang, Yeardley Smith, Don Cummings, Nick Toth, Kathryn Joosten, Shirley Prestia, J.D. Walsh, Floyd 'Red Crow' Westerman","Comedy, Romance",United States,English,"20th Century Fox Television, 4 to 6 Foot Productions, Chuck Lorre Productions",https://www.imdb.com/title/tt0118303/?ref_=sr_i_1091
Iron Fist,"(2017, 2018)",TV-MA,55.0,6.4,142000,0,Scott Buck,"Finn Jones, Jessica Henwick, Jessica Stroup, Tom Pelphrey, Sacha Dhawan, David Wenham, Alice Eve, Wai Ching Ho, Giullian Yao Gioiello, Christine Toy Johnson, Barrett Doss, Fernando Chien, Simone Missick, Natalie Smith, Henry Yuk, Rosario Dawson, Ramón Rodríguez, Clifton Davis","Action, Adventure, Crime, Fantasy, Sci-Fi",United States,"English, Mandarin, Japanese, Russian, Korean","Marvel Television, Devilina Productions, ABC Signature",https://www.imdb.com/title/tt3322310/?ref_=sr_i_1090
